However , we know we are responsible to our citizens .	Tudjuk azonban , hogy felelősek vagyunk polgárainkért .	2-0 3-0 0-1 1-1 7-3 6-4 4-5 5-5 8-6 9-6 10-7
That is significantly more than the European Union 's budget .	Ez jelentősen meghaladja az Európai Unió költségvetését .	0-0 1-0 2-1 3-2 4-2 5-3 6-4 7-5 8-6 9-6 10-7
The first key point is the importance of the sector .	Az első kulcskérdés az ágazat fontossága .	0-0 1-1 2-2 3-2 4-2 5-3 8-3 9-4 6-5 7-5 10-6
There are also control mechanisms at local and national level .	Helyi és országos szinten is vannak ellenőrzési mechanizmusok .	6-0 7-1 8-2 5-3 9-3 2-4 0-5 1-5 3-6 4-7 10-8
This is not acceptable and we must deal with it .	Ez elfogadhatatlan , foglalkoznunk kell vele .	0-0 1-0 2-1 3-1 4-2 5-3 7-3 6-4 8-5 9-5 10-6
Ukraine was mentioned , as well as the Balkan regions .	Ukrajnát említették , illetve a balkáni térségeket .	0-0 1-1 2-1 3-2 4-3 5-3 6-3 7-4 8-5 9-6 10-7
There will be 18 new Members from 12 Member States .	18 új képviselő érkezik majd 12 tagállamból .	3-0 4-1 5-2 0-3 6-3 1-4 2-4 7-5 8-6 9-6 10-7
The European Union has a duty to combat this situation .	Az Európai Uniónak kötelessége küzdenie e helyzet ellen .	0-0 1-1 2-2 3-3 4-3 5-3 6-4 7-4 8-5 9-6 10-8
In a crisis situation , democratic forces must join together .	Válsághelyzetben a demokratikus erőknek össze kell fognia .	0-0 1-0 2-0 3-0 4-1 5-2 6-3 9-4 7-5 8-6 10-7
The Czech Republic is also part of the European Union .	A Cseh Köztársaság is része az Európai Uniónak .	0-0 1-1 2-2 4-3 3-4 5-4 6-4 7-5 8-6 9-7 10-8
Independent organisations representing working people and the poor are critical .	A dolgozó embereket és a szegényeket képviselő független szervezetek kulcsfontosságúak .	3-1 4-2 5-3 6-4 7-5 2-6 0-7 1-8 8-9 9-9 10-10
The sovereign debt crisis has just confirmed their pro-cyclical nature .	Az államadósság-válság mindössze megerősítette azok prociklusos jellegét .	0-0 1-1 2-1 3-1 5-2 4-3 6-3 7-4 8-5 9-6 10-7
The United Nations and the European Union are natural partners .	Az ENSZ és az Európai Unió természetes szövetségesek .	0-0 1-1 2-1 3-2 4-3 5-4 6-5 8-6 7-7 9-7 10-8
Baroness Ashton was not able to remain with us today .	Ashton bárónő nem tudott ma velünk maradni .	1-0 0-1 3-2 2-3 4-3 5-3 9-4 7-5 8-5 6-6 10-7
I would like to thank the Council for its response .	Szeretném megköszönni a Tanácsnak válaszát .	0-0 1-0 2-0 3-1 4-1 5-2 6-3 7-4 8-4 9-4 10-5
That is why the Commission can accept the amendment proposed .	Ezért tudja elfogadni a Bizottság a javasolt módosítást .	0-0 1-0 2-0 5-1 6-2 3-3 4-4 7-5 9-6 8-7 10-8
Thank you , Mr Berlinguer , for raising this matter .	Köszönöm , Berlinguer úr , hogy felvetette a kérdést .	0-0 1-0 2-1 4-2 3-3 5-4 6-5 7-6 8-7 9-8 10-9
This often does not happen in the best possible way .	Ez gyakran nem a lehető legjobb módon történik .	0-0 1-1 2-2 3-2 6-3 8-4 7-5 5-6 9-6 4-7 10-8
The impact assessment that you have presented is very good .	Az ön által benyújtott hatásvizsgálat rendkívül jó .	0-0 4-1 5-1 3-2 6-3 1-4 2-4 7-5 8-5 9-6 10-7
We will also modernise our development policy and humanitarian aid .	Továbbá modernizálni fogjuk fejlesztési politikánkat és humanitárius segítségnyújtásunkat .	2-0 3-1 0-2 1-2 5-3 4-4 6-4 7-5 8-6 9-7 10-8
The complete absence of this spirit is one of our problems .	E szellemiség teljes hiánya egyike problémáinknak .	4-0 5-1 1-2 2-3 3-3 6-4 7-4 8-4 9-5 10-5 11-6
Sometimes utopia can be the best form of realism .	Olykor az utópia lehet a realizmus legjobb formája .	0-0 1-2 2-3 3-3 4-4 8-5 5-6 6-7 7-7 9-8
The risks will be more evident looking towards 2008 .	A kockázatok 2008 felé tekintve nyilvánvalóbban lesznek .	0-0 1-1 8-2 7-3 6-4 4-5 5-5 2-6 3-6 9-7
Existing legislation on water can also be employed here .	A vízre vonatkozóan meglévő jogszabályok itt is alkalmazhatók .	3-1 2-2 0-3 1-4 8-5 5-6 4-7 6-7 7-7 9-8
But we must not only look at the difficulties .	Azonban nemcsak a nehézségeket kell néznünk .	0-0 3-1 4-1 7-2 8-3 2-4 1-5 5-5 6-5 9-6
Consequently , the fisheries policy is not the CAP .	Következésképpen a halászati politika nem a KAP .	0-0 1-0 2-1 3-2 4-3 5-4 6-4 7-5 8-6 9-7
Unfortunately , however , the situation has changed somewhat .	Sajnos azonban a helyzet némileg megváltozott .	0-0 1-0 2-1 3-1 4-2 5-3 8-4 6-5 7-5 9-6
Any progress in this area will be very positive .	E területen bármilyen előrehaladás elérése igen kedvezőnek bizonyul majd .	3-0 2-1 4-1 0-2 1-3 7-5 8-6 6-7 5-8 9-9
Opportunities for new technologies and clean and renewable energy .	Lehetőségeket az új technológiákra és tiszta és megújuló energiára .	0-0 1-1 2-2 3-3 4-4 5-5 6-6 7-7 8-8 9-9
Of course , it is also a strategic agreement .	Természetesen ez egy stratégiai megállapodás is .	0-0 1-0 2-0 3-1 4-1 6-2 7-3 8-4 5-5 9-6
My colleague has already prepared some proposals on this .	Kollégám már elkészített néhány javaslatot ezzel kapcsolatban .	0-0 1-0 2-1 3-1 4-2 5-3 6-4 8-5 7-6 9-7
Which Community initiatives could be used for this purpose ?	Milyen közösségi kezdeményezések alkalmazhatók e célra ?	0-0 1-1 2-2 3-3 4-3 5-3 7-4 6-5 8-5 9-6
Europe has changed , and the world has changed .	Európa megváltozott , a világ megváltozott .	0-0 1-1 2-1 3-2 4-2 5-3 6-4 7-5 8-5 9-6
It does not stand up to any kind of scrutiny .	Ez nem áll ki semmiféle ellenőrzést .	0-0 1-1 2-1 3-2 4-3 5-3 6-4 7-4 9-5 10-6
Thank you for your attention and for your support .	Köszönöm figyelmüket és támogatásukat .	0-0 1-0 2-0 3-1 4-1 5-2 6-3 7-3 8-3 9-4
It is perhaps the last chance for this Treaty .	Talán ez az utolsó esély erre a Szerződésre .	2-0 0-1 1-1 3-2 4-3 5-4 7-5 6-6 8-7 9-8
Relations between the EU and Russia are incredibly complex .	Az EU és Oroszország közötti kapcsolatok hihetetlenül összetettek .	2-0 3-1 4-2 5-3 1-4 0-5 7-6 6-7 8-7 9-8
That is easy to answer : the young generation .	Erre könnyű válaszolni : a fiatal nemzedék .	0-0 1-1 2-1 3-2 4-2 5-3 6-4 7-5 8-6 9-7
It is worth considering Community action in this regard .	Érdemes e tekintetben közösségi fellépést mérlegelni .	0-0 1-0 2-0 7-1 6-2 8-2 4-3 5-4 3-5 9-6
But we are not remaining silent about such developments .	De nem hallgatunk az ilyen eseményekről .	0-0 3-1 1-2 2-2 4-2 5-2 7-4 6-5 8-5 9-6
It was an important strategic factor for the West .	Ez fontos stratégiai tényező volt a Nyugat számára .	0-0 2-1 3-1 4-2 5-3 1-4 7-5 8-6 6-7 9-8
I am sorry , but it is not possible .	Sajnálom , de erre nincs lehetőség .	0-0 1-0 2-0 3-1 4-2 5-3 6-4 7-4 8-5 9-6
The simplified Treaty is a political victory for Europe .	Az egyszerűsített szerződés politikai győzelem Európa számára .	0-0 1-1 2-2 5-3 3-4 4-4 6-4 8-5 7-6 9-7
Mr Mitchell quite rightly highlighted the Millennium Development Goals .	Mitchell úr igen helyesen hangsúlyozta a Millenniumi Fejlesztési Célokat .	1-0 0-1 2-2 3-3 4-4 5-5 6-6 7-7 8-8 9-9
The Commission does not want to change the guidelines .	A Bizottság nem akarja megváltoztatni az iránymutatást .	0-0 1-1 2-2 3-2 4-3 5-3 6-4 7-5 8-6 9-7
In today 's situation this is an incomprehensible anachronism .	A mai helyzetben ez egy érthetetlen anakronizmus .	0-0 1-1 2-1 3-2 4-3 5-3 6-4 7-5 8-6 9-7
A big responsibility rests here with the Portuguese Presidency .	Itt továbbra is hatalmas felelősség terheli a portugál elnökséget .	4-0 0-3 1-3 2-4 3-5 5-5 6-6 7-7 8-8 9-9
However , we also need to look beyond Bali .	Nekünk azonban Balin túlra is kell tekintenünk .	2-0 0-1 1-1 8-2 7-3 3-4 4-5 5-5 6-6 9-7
We do not want to reopen the ICCAT plan .	Nem akarjuk újrakezdeni az ICCAT-tervet .	1-0 2-0 0-1 3-1 4-2 5-2 6-3 7-4 8-4 9-5
There are three ways in which we can act .	Háromféleképpen cselekedhetünk .	0-0 1-0 2-0 3-0 4-1 5-1 6-1 7-1 8-1 9-2
The final version thoroughly softens the rules on advertising .	A végső változat alaposan felpuhítja a reklámozás szabályait .	0-0 1-1 2-2 3-3 4-4 5-5 8-6 6-7 7-7 9-8
The conditions for meeting these requirements vary , however .	Az említett követelmények teljesítésére vonatkozó feltételek azonban eltérőek .	0-0 4-1 5-2 3-3 2-4 1-5 7-6 8-6 6-7 9-8
However , a few points need to be considered .	Néhány pontot azonban figyelembe kell venni .	2-0 3-0 4-1 0-2 1-2 5-4 6-4 7-5 8-5 9-6
The Union does not have competence in this field .	Az Unió nem rendelkezik hatáskörrel e téren .	0-0 1-1 2-2 3-2 4-3 5-4 7-5 6-6 8-6 9-7
I think that the result could be quite good .	Szerintem az eredmény egész jó lehet .	0-0 1-0 2-0 3-1 4-2 7-3 8-4 5-5 6-5 9-6
This reflects the changes in the Commission 's priorities .	Ez a bizottsági prioritások változását tükrözi .	0-0 2-1 5-1 6-2 7-2 8-3 3-4 4-4 1-5 9-6
Nevertheless , I would like to highlight several points .	Mindazonáltal ki szeretnék emelni néhány pontot .	0-0 1-0 2-2 3-2 4-2 5-3 6-3 7-4 8-5 9-6
This is an asymmetric system , a transitional period .	Ez egy aszimmetrikus rendszer , egy átmeneti időszak .	0-0 1-0 2-1 3-2 4-3 5-4 6-5 7-6 8-7 9-8
As you can see , it is quite intense .	Amint látja , elég feszített .	0-0 1-1 2-1 3-1 4-2 5-3 6-3 7-3 8-4 9-5
So thank you very much , ladies and gentlemen .	Köszönöm tehát , hölgyeim és uraim .	1-0 2-0 3-0 4-0 0-1 5-2 6-3 7-4 8-5 9-6
The directive has stood the test of time well .	Az irányelv kiállta az idő próbáját is .	0-0 1-1 2-2 3-2 4-3 7-4 5-5 6-5 8-6 9-7
The UCITS Directive has become a huge brand globally .	Az ÁÉKBV irányelv globális szinten az alapok egy hatalmas típusává vált .	0-0 1-1 2-2 5-7 6-8 7-9 8-9 3-10 4-10 9-11
The European Union and the Member States are united .	Az Európai Unió és a tagállamok egységesek .	0-0 1-1 2-2 3-3 4-4 5-5 6-5 7-6 8-6 9-7
Prime ministers have cancelled the results of two referendums .	A miniszterelnökök eltörölték a két népszavazás eredményeit .	0-1 1-1 2-2 3-2 4-3 7-4 8-5 5-6 6-6 9-7
Continued dialogue between airports and transport operators is indispensable .	A repülőterek és a fuvarozók közötti folyamatos párbeszéd elengedhetetlen .	3-1 4-2 5-4 6-4 2-5 0-6 1-7 7-8 8-8 9-9
Finally , I cannot accept Amendments 7 and 9 .	Végül számomra elfogadhatatlan a 7. és a 9. módosítás .	0-0 1-0 2-1 3-2 4-2 6-4 7-5 8-7 5-8 9-9
The Slovenian Presidency 's programme undoubtedly contains worthy elements .	Kétségtelen , hogy a szlovén elnökség programja kiváló elemeket tartalmaz .	5-0 0-3 1-4 2-5 3-6 4-6 7-7 8-8 6-9 9-10
These were girls from the so-called Polish Service organisation .	Ezek voltak az úgynevezett lengyel szolgáltatási szervezethez tartozó lányok .	0-0 1-1 4-2 5-3 6-4 7-5 8-6 3-7 2-8 9-9
Many young women have been forced into sexual slavery .	Számos fiatal nőt kényszerítettek szexuális rabszolgaságra .	0-0 1-1 2-2 3-3 4-3 5-3 7-4 6-5 8-5 9-6
Now , however , we have a second chance .	Most azonban kaptunk egy második esélyt .	0-0 1-1 2-1 3-1 4-2 5-2 6-3 7-4 8-5 9-6
However , the Treaty is not in force yet .	A Szerződés azonban még nem lépett hatályba .	2-0 3-1 0-2 1-2 4-3 8-3 5-4 6-5 7-6 9-7
The Directive allows Member States flexibility in this regard .	Az irányelv e tekintetben rugalmasságot enged a tagállamoknak .	0-0 1-1 7-2 6-3 8-3 5-4 2-5 3-7 4-7 9-8
This will be the next test of European leadership .	Ez lesz az európai vezetés következő próbatétele .	0-0 1-1 2-1 3-2 7-3 8-4 4-5 5-6 6-6 9-7
No , because the law has to be effective .	Nem , hiszen a jognak hatékonynak kell lennie .	0-0 1-1 2-2 3-3 4-4 5-5 8-5 6-6 7-7 9-8
The principle of mutual recognition applies to a huge market .	A kölcsönös elismerés elve egy hatalmas piacon belül érvényesül .	0-0 3-1 4-2 1-3 2-3 7-4 8-5 9-6 5-8 10-9
However , we must also talk about the location .	Persze ugyancsak beszélnünk kell a helyszínről is .	0-0 1-0 4-1 2-2 5-2 6-2 3-3 7-4 8-5 9-7
Nor can the suffering of those affected be compensated .	Az érintettek szenvedését sem lehet kompenzálni .	2-0 5-1 6-1 3-2 4-2 0-3 1-4 7-4 8-5 9-6
But the Lisbon Strategy is not a static process .	De a lisszaboni stratégia nem egy statikus folyamat .	0-0 1-1 2-2 3-3 4-4 5-4 6-5 7-6 8-7 9-8
The Court of Justice leaves no room for doubt .	A Bíróság nem hagy kétséget .	0-0 1-1 2-1 3-1 5-2 4-3 6-3 7-3 8-4 9-5
The first possible date would be 1 January 2009 .	Az első lehetséges időpont 2009. január 1-je .	0-0 1-1 2-2 4-2 5-2 3-3 8-4 7-5 6-6 9-7
This is much higher than the amount currently available .	Ez jóval magasabb , mint a jelenleg hozzáférhető összeg .	0-0 1-0 2-1 3-2 4-4 5-5 7-6 8-7 6-8 9-9
Let us help resolve the shortage of drinking water .	Nyújtsunk segítséget az ivóvízhiány megoldásához .	0-0 1-0 2-1 4-2 5-3 6-3 7-3 8-3 3-4 9-5
That is an appalling and discriminatory kind of logic !	Ez egy szörnyű és diszkrimináló gondolkodásmód !	0-0 1-0 2-1 3-2 4-3 5-4 6-4 7-5 8-5 9-6
It could be a key to better economic success .	Ez lehetne a sikeresebb gazdaság kulcsa .	0-0 1-1 2-1 3-2 6-3 8-3 7-4 4-5 5-5 9-6
This is very demanding , but circumstances require it .	Ez nagyon megerőltető , de a körülmények rákényszerítenek .	0-0 1-0 2-1 3-2 4-3 5-4 6-6 7-7 8-7 9-8
This is a fine aim , a good aim .	Ez egy jó cél , egy kitűnő cél .	0-0 1-0 2-1 3-2 4-3 5-4 6-5 7-6 8-7 9-8
I would like to express my thanks for this .	Szeretném kifejezni köszönetemet ezért .	0-0 1-0 2-0 3-1 4-1 5-2 6-2 7-3 8-3 9-4
The Commission is monitoring the EC-Morocco Fisheries Partnership Agreement .	A Bizottság figyelemmel kíséri az EK-Marokkó halászati partnerségi megállapodást .	0-0 1-1 3-2 2-3 4-4 5-5 6-6 7-7 8-8 9-9
I would like to add something on human rights .	Szeretném valamivel kiegészíteni az emberi jogokat .	0-0 1-0 2-0 5-1 3-2 4-2 6-3 7-4 8-5 9-6
I think that even the Commissioners should start protesting .	Szerintem még a biztosoknak is tiltakozniuk kellene .	0-0 1-0 2-0 3-1 4-2 5-3 7-5 8-5 6-6 9-7
Today , unfortunately , this is not the case .	Ma sajnos nem ez a helyzet .	0-0 1-1 2-1 3-1 6-2 4-3 5-3 7-4 8-5 9-6
I would like to congratulate the rapporteur Bairbre de Brún .	Szeretnék gratulálni Bairbre de Brún előadónak .	0-0 1-0 2-0 3-1 4-1 7-2 8-3 9-4 6-5 10-6
The Lisbon Agenda requires a strengthening of social measures .	A lisszaboni menetrend a szociális intézkedések megerősítését követeli .	0-0 1-1 2-2 4-3 7-4 8-5 5-6 6-6 3-7 9-8
That is why I am voting against the report .	Ezért szavazok a jelentés ellen .	0-0 1-0 2-0 3-1 4-1 5-1 7-2 8-3 6-4 9-5
In North America it is less than 5 % .	Észak-Amerikában ez kevesebb mint 5 % .	0-0 1-0 2-0 3-1 4-1 5-2 6-3 7-4 8-5 9-6
A genuine consumer protection policy must obey various principles .	Egy valódi fogyasztóvédelmi politikának különböző elveket kell betartania .	0-0 1-1 2-2 3-2 4-3 7-4 8-5 5-6 6-7 9-8
As I have said , we should go further .	Amint említettem , tovább kell haladnunk !	0-0 1-1 2-1 3-1 4-2 8-3 6-4 5-5 7-5 9-6
The other very important thing is the Adaptation Fund .	A másik nagyon fontos dolog az adaptációs alap .	0-0 1-1 2-2 3-3 4-4 5-4 6-5 7-6 8-7 9-8
On the contrary , everything came to a standstill .	Ellenkezőleg , minden leállt .	0-0 1-0 2-0 3-1 4-2 5-3 6-3 7-3 8-3 9-4
However , there is still work to be done .	Van azonban még tennivaló .	2-0 3-0 0-1 1-1 4-2 5-3 6-3 7-3 8-3 9-4
Can the Commission suggest any initiative in this direction ?	Tud a Bizottság ez irányba valamilyen kezdeményezést javasolni ?	0-0 1-1 2-2 7-3 6-4 8-4 4-5 5-6 3-7 9-8
Let us not then talk about 1 000 metres .	Akkor ne beszéljünk 1000 méterről .	3-0 2-1 0-2 1-2 4-2 5-2 6-3 7-3 8-4 9-5
The adopted amendments somewhat improve the Council 's proposal .	Az elfogadott módosítások valamelyest javítottak a Tanács javaslatán .	0-0 1-1 2-2 3-3 4-4 5-5 6-6 7-7 8-7 9-8
Nearly two million immigrants come here legally every year .	Legálisan évente csaknem 2 millió bevándorló jön ide .	6-0 7-1 8-1 0-2 1-3 2-4 3-5 4-6 5-7 9-8
The partnership between the EU and Russia is uneasy .	Az EU és Oroszország közötti partnerség nehéz ügy .	0-0 3-0 4-1 5-2 6-3 2-4 1-5 7-6 8-7 9-8
Mr President , the negotiations will not be easy .	Elnök úr , a tárgyalások nem lesznek könnyűek .	1-0 0-1 2-2 3-3 4-4 6-5 5-6 7-6 8-7 9-8
The report by the United Nations rapporteur is clear .	Az ENSZ előadó jelentése egyértelmű .	0-0 3-0 4-1 5-1 6-2 1-3 2-3 7-4 8-4 9-5
Mr President , this is a very serious issue .	Elnök úr , ez egy nagyon súlyos kérdés .	1-0 0-1 2-2 3-3 4-3 5-4 6-5 7-6 8-7 9-8
They also contribute to investment for the longer term .	Hosszabb távon is hozzájárulnak a befektetésekhez .	7-0 8-1 1-2 0-3 2-3 3-3 6-4 4-5 5-5 9-6
This is an arbitrary , brutal and paranoid regime .	Ez egy önkényes , brutális és paranoid rezsim .	0-0 1-0 2-1 3-2 4-3 5-4 6-5 7-6 8-7 9-8
The European Union does not aim to achieve superiority .	Az Európai Uniónak nem célja előnyhöz jutni .	0-0 1-1 2-2 3-3 4-3 5-4 8-5 6-6 7-6 9-7
You mention the European Pact on Immigration and Asylum .	Felemlítette az Európai Bevándorlási és Menedékjogi Megállapodást .	0-0 1-0 2-1 3-2 4-3 5-3 6-3 7-4 8-5 9-7
Mr Farage is wrong : this is not democracy .	Farage úr téved : ez nem demokrácia .	1-0 0-1 2-2 3-2 4-3 5-4 6-4 7-5 8-6 9-7
Now we have a war between Russia and Georgia .	Most háború van Oroszország és Grúzia között .	0-0 1-0 4-1 2-2 3-2 6-3 7-4 8-5 5-6 9-7
Mr President , I voted against the Bowles report .	Elnök úr , én a Bowles-jelentés ellen szavaztam .	1-0 0-1 2-2 3-3 6-4 7-5 8-5 5-6 4-7 9-8
That was an important interim debate on the budget .	Ez egy fontos időközi vita volt a költségvetésről .	0-0 2-1 3-2 4-3 5-4 1-5 7-6 6-7 8-7 9-8
The sector accounts for 3 % of European GDP .	Az ágazat adja az európai GDP 3 % -át .	0-0 1-1 2-2 3-3 7-4 8-5 4-6 5-7 6-8 9-9
A second delicate point concerns the financial services market .	A második érzékeny pont a pénzügyi szolgáltatások piacára vonatkozik .	0-0 1-1 2-2 3-3 5-4 6-5 7-6 8-7 4-8 9-9
The precautionary principle also prevents the spread of illnesses .	Az elővigyázatossági elv a betegségek terjedését is megakadályozza .	0-0 1-1 2-2 5-3 8-4 6-5 7-5 3-6 4-7 9-8
The second point is the operational side of things .	A második pont a dolgok operatív oldala .	0-0 1-1 2-2 3-2 4-3 8-4 5-5 6-6 7-6 9-7
Thank you for your transnational plea , Mr Martinez .	Köszönöm transznacionális védőbeszédét , Martinez úr .	0-0 1-0 2-0 4-1 3-2 5-2 6-3 8-4 7-5 9-6
However , the directive itself is not the answer .	Azonban az irányelv önmagában nem ad választ .	0-0 1-0 2-1 3-2 4-3 5-3 6-4 7-5 8-6 9-7
Finally , this is a huge issue for Europe .	Végül , ez egy hatalmas kérdés Európa számára .	0-0 1-1 2-2 3-2 4-3 5-4 6-5 8-6 7-7 9-8
What does the Commission have to say about this ?	Mit szól ehhez a Bizottság ?	0-0 1-0 6-1 7-1 4-2 5-2 8-2 2-3 3-4 9-5
Can you make sure the technical problem is solved ?	Tudna gondoskodni a technikai probléma megoldásáról ?	0-0 1-0 2-1 3-1 4-2 5-3 6-4 7-4 8-5 9-6
The European Council meets on 15 and 16 October .	Az Európai Tanács október 15-én és 16-án ülésezik .	0-0 1-1 2-2 8-3 4-4 5-4 6-5 7-6 3-7 9-8
So we should have voted also on Amendment 4 .	Így szavaznunk kellett volna a 4. módosításról is .	0-0 1-1 4-1 2-2 3-3 8-5 6-6 7-6 5-7 9-8
That is why I supported the report by Mr Panzeri .	Ezért támogattam Panzeri úr jelentését .	0-0 1-0 2-0 3-1 4-1 9-2 8-3 6-4 7-4 10-5
Some 100 000 such couples have registered since 1990 .	1990 óta mintegy 100 000 ilyen házaspárt vettek nyilvántartásba .	8-0 7-1 0-2 1-3 2-4 3-5 4-6 5-7 6-8 9-9
Adopting the restructuring plans would provide such an opportunity .	A szerkezetátalakítási tervek elfogadása ilyen lehetőséget biztosítana .	1-0 2-1 3-2 0-3 6-4 7-5 8-5 4-6 5-6 9-7
The next Cohesion Report will be presented in 2010 .	A következő kohéziós jelentés 2010-ben kerül benyújtásra .	0-0 1-1 2-2 3-3 7-4 8-4 4-5 5-5 6-6 9-7
However , this is not fraud , but wastefulness .	Azonban ez nem csalás , hanem pazarlás .	0-0 1-0 2-1 3-1 4-2 5-3 6-4 7-5 8-6 9-7
It is now the Council we are waiting for .	Most a Tanácsra várunk .	0-0 1-0 2-0 3-1 4-2 5-3 6-3 7-3 8-3 9-4
The climate change package is extremely important and sensitive .	A klímacsomag rendkívül fontos és érzékeny .	0-0 1-1 2-1 3-1 5-2 4-3 6-3 7-4 8-5 9-6
We want this in particular - and by 2012 .	Ezt különösen akarjuk - és 2012-re .	2-0 3-1 4-1 0-2 1-2 5-3 6-4 7-5 8-5 9-6
However , they are fragile and merit special attention .	Ugyanakkor sérülékenyek és különleges figyelmet érdemelnek .	0-0 1-0 2-1 3-1 4-1 5-2 7-3 8-4 6-5 9-6
On this basis , I support Mr Kindermann 's report .	Ennek alapján támogatom Kindermann úr jelentését .	1-0 0-1 2-1 4-2 5-2 7-3 6-4 8-5 9-5 10-6
Mr Wojciechowski , we will help the Czech Presidency .	Wojciechowski úr , segíteni fogjuk a cseh elnökséget .	1-0 0-1 2-2 5-3 3-4 4-4 6-5 7-6 8-7 9-8
Mr President , ' Europe acted as one ' .	Elnök úr , " Európa egy emberként cselekedett ” .	1-0 0-1 2-2 3-3 4-4 7-5 6-6 5-7 8-8 9-9
It also retains the gradual adoption of full auctioning .	Fenntartja továbbá a teljes árverés fokozatos bevezetésének elképzelését is .	0-0 2-0 1-1 3-2 7-3 8-4 4-5 5-6 6-6 9-9
The Commission will not be fully implementing the budget .	A Bizottság nem fogja maradéktalanul végrehajtani a költségvetést .	0-0 1-1 3-2 2-3 5-4 4-5 6-5 7-6 8-7 9-8
We receive only a tiny proportion of these people .	Mi ezeknek az embereknek csak egy egészen kicsi részét kapjuk .	0-0 7-1 8-3 2-4 3-5 4-7 5-8 6-8 1-9 9-10
I hope that it will reach you before Christmas .	Remélem , még karácsony előtt eljut Önhöz .	0-0 1-0 2-1 3-2 8-3 7-4 4-5 5-5 6-6 9-7
We have abandoned the scientific principle of risk assessment .	Lemondtunk a kockázatértékelés tudományos elvéről .	0-0 1-0 2-0 3-1 7-2 8-2 4-3 5-4 6-4 9-5
The problem with France must be solved with understanding .	Franciaország problémáját megértéssel kell megoldani .	3-0 0-1 1-1 2-2 7-2 8-2 4-3 5-3 6-4 9-5
In Estonia it has been in force since 2000 .	Észtországban ez már 2000 óta hatályos .	0-0 1-0 2-1 3-2 4-2 8-3 7-4 5-5 6-5 9-6
An international agreement would be more appropriate and far-sighted .	Megfelelőbb és messzebbre tekintő lenne egy nemzetközi megállapodás .	5-0 6-0 7-1 8-3 3-4 4-4 0-5 1-6 2-7 9-8
They have to ask us and the European Union .	Nekik kell kérniük tőlünk és az Európai Uniótól .	0-0 1-1 2-1 3-2 4-3 5-4 6-5 7-6 8-7 9-8
So it is difficult - what can we do ?	Szóval nehéz - mit tehetünk ?	0-0 1-1 2-1 3-1 4-2 5-3 6-4 7-4 8-4 9-5
Shirin Ebadi 's persecution is not an isolated incident .	Sirin Ebadi üldöztetése nem elszigetelt esemény .	0-0 1-1 2-1 3-2 4-3 5-3 6-4 7-4 8-5 9-6
The key to success lies in the agricultural sector .	A siker kulcsa a mezőgazdaság .	0-0 3-1 1-2 2-2 4-2 5-3 6-3 7-4 8-4 9-5
I must also emphasise the issue of nuclear power .	Hangsúlyoznom kell az atomenergia kérdését is .	0-0 3-0 1-1 4-2 7-3 8-3 5-4 6-4 2-5 9-6
Even the Green group did not vote against it .	Még a Zöldek sem szavaztak ellene .	0-0 1-1 2-2 3-2 5-3 4-4 6-4 7-5 8-5 9-6
Trading relations between the EU and Israel will continue .	Az EU és Izrael közötti kereskedelmi kapcsolatok folytatódnak .	3-0 4-1 5-2 6-3 2-4 0-5 1-6 7-7 8-7 9-8
The EU has launched the EULEX mission in Kosovo .	Az EU elindította az EULEX-missziót Koszovóban .	0-0 1-1 2-2 3-2 4-3 5-4 6-4 7-5 8-5 9-6
That is why I do not agree with Proinsias .	Ezért nem értek egyet Proinsias úrral .	0-0 1-0 2-0 5-1 3-2 4-2 6-3 8-4 7-5 9-6
We are grateful : this is a real achievement .	Hálásak vagyunk : ez egy valódi eredmény .	2-0 0-1 1-1 3-2 4-3 5-3 6-4 7-5 8-6 9-7
This is a de facto and de jure situation .	Ez egy de facto és de jure helyzet .	0-0 1-0 2-1 3-2 4-3 5-4 6-5 7-6 8-7 9-8
The crisis has an impact on the labour market .	A válság kihat a munkaerőpiacra .	0-0 1-1 2-2 3-2 4-2 5-2 6-3 7-4 8-4 9-5
The situation with childcare in Slovakia is rather complicated .	A gyermekgondozás helyzete Szlovákiában meglehetősen bonyolult .	0-0 2-1 3-1 1-2 4-3 5-3 6-4 7-4 8-5 9-6
As for us , we will continue this fight .	Ami minket illet , folytatni fogjuk a küzdelmet .	0-0 2-1 1-2 3-3 6-4 4-5 5-5 7-6 8-7 9-8
The financial crisis is now affecting the real economy .	A pénzügyi válság most a reálgazdaságot érinti .	0-0 1-1 2-2 3-3 4-3 6-4 7-5 8-5 5-6 9-7
This , of course , is not by chance .	Ez természetesen nem véletlen .	0-0 1-1 2-1 3-1 4-1 6-2 5-3 7-3 8-3 9-4
We have a perfectly good Chamber back in Brussels .	Van egy tökéletesen megfelelő termünk Brüsszelben .	0-0 1-0 2-1 3-2 4-3 5-4 6-4 7-5 8-5 9-6
This is a small step towards a major objective .	Ez egy apró lépés egy nagy cél felé .	0-0 1-0 2-1 3-2 4-3 6-4 7-5 8-6 5-7 9-8
Fourthly , the healthcare sector must be better coordinated .	Negyedszer , az egészségügyi ágazatot jobban kell koordinálni .	0-0 1-1 2-2 3-3 4-4 7-5 5-6 6-6 8-7 9-8
I want to thank Mr Meijer for his remarks .	Szeretném megköszönni Meijer úr észrevételeit .	0-0 1-0 2-1 3-1 6-1 5-2 4-3 7-4 8-4 9-5
What is more , the government also blocks websites .	Mi több , a kormány honlapokat is blokkol .	0-0 1-0 2-1 3-2 4-3 5-4 8-5 6-6 7-7 9-8
I have tried to make the process very transparent .	Igyekeztem nagyon átláthatóvá tenni a folyamatot .	0-0 1-0 2-0 7-1 8-2 3-3 4-3 5-4 6-5 9-6
That is why this proposal for amendment is appropriate .	Ezért megfelelő ez a módosítási javaslat .	0-0 1-0 2-0 8-1 3-2 7-2 5-3 6-4 4-5 9-6
Yes , we see unity when leaders meet leaders .	Igen , egységet látunk , mikor vezetők találkoznak vezetőkkel .	0-0 1-1 4-2 2-3 3-3 5-5 6-6 7-7 8-8 9-9
