The same is also true for the Europe 2020 action programme .	Ugyanez igaz továbbá az Európa 2020 cselekvési programra .	0-0 1-0 2-1 4-1 3-2 5-3 6-3 7-4 8-5 9-6 10-7 11-8
We have two small pipelines : the ITGI and the TAP .	Van két kicsi földgázvezetékünk : az ITGI és a TAP .	0-0 1-0 2-1 3-2 4-3 5-4 6-5 7-6 8-7 9-8 10-9 11-10
Madam President , relations between Europe and Africa are under strain .	Elnök asszony , az Európa és Afrika közötti kapcsolatok feszültek .	1-0 0-1 2-2 5-4 6-5 7-6 4-7 3-8 8-9 9-9 10-9 11-10
That is why I am supporting the Council and the Commission .	Ezért támogatom a Tanácsot és a Bizottságot .	0-0 1-0 2-0 3-1 4-1 5-1 6-2 7-3 8-4 9-5 10-6 11-7
This , I believe , raises the issue of equal treatment .	Véleményem szerint ez felveti az egyenlő bánásmód kérdését .	2-0 3-0 1-1 4-1 0-2 5-3 6-4 9-5 10-6 7-7 8-7 11-8
The language used should be straightforward and easy to understand .	A nyelvhasználat legyen egyértelmű , könnyen érthető .	0-0 1-1 2-1 3-2 4-2 5-3 6-4 7-5 8-5 9-6 10-7
I think that the report is very good and balanced .	Szerintem a jelentés nagyon jó és kiegyensúlyozott .	0-0 1-0 2-0 3-1 4-2 5-3 6-3 7-4 8-5 9-6 10-7
However , we need to do the necessary preparatory work .	Ám el kell végeznünk a szükséges előkészítő munkát .	0-0 1-0 2-1 3-2 4-2 5-3 6-4 7-5 8-6 9-7 10-8
To some extent the higher prices tell the environmental truth .	Bizonyos mértékig a magasabb árak a környezeti igazságot mondják ki .	1-0 0-1 2-1 3-2 4-3 5-4 7-5 8-6 9-7 6-8 10-10
In conclusion , Parliament recalls the discussion on collective redress .	Végezetül a Parlament emlékeztet a kollektív jogorvoslattal kapcsolatos vitára .	1-0 2-0 0-1 3-2 4-3 5-4 8-5 9-6 7-7 6-8 10-9
All those factors will make using the train more attractive .	Mindezen tényezők vonzóbbá teszik a vasút használatát .	0-0 1-0 2-1 8-2 9-2 3-3 4-3 6-4 7-5 5-6 10-7
That is why I will support the Commission 's proposals .	Ezért én támogatni fogom a Bizottság javaslatát .	0-0 1-0 2-0 3-1 5-2 4-3 6-4 7-5 8-6 9-6 10-7
On 13 November 2006 the Council adopted these recommendations unanimously .	2006. november 13-án a Tanács egyhangúan elfogadta ezeket az ajánlásokat .	3-0 2-1 0-2 1-2 4-3 5-4 9-5 6-6 7-7 8-9 10-10
The Italian federalist Tommaso Padoa-Schioppa has already given the answer .	Az olasz föderalista Tommaso Padoa-Schioppa már megadta a választ .	0-0 1-1 2-2 3-3 4-4 5-5 6-5 7-6 8-7 9-8 10-9
The Kosovo problem is , of course , preoccupying us .	Koszovó kérdése természetesen aggaszt minket .	0-0 1-0 2-1 3-1 4-2 5-2 6-2 7-2 8-3 9-4 10-5
However , the resolution makes some recommendations on this point .	Mindazonáltal az állásfoglalás tartalmaz néhány ajánlást ez ügyben .	0-0 1-0 2-1 3-2 4-3 5-4 6-5 8-6 7-7 9-7 10-8
In the Middle East there has been no progress made .	A Közel-Keleten nem történt előrelépés .	0-0 1-0 2-1 3-1 7-2 4-3 5-3 6-3 8-4 9-4 10-5
So far , postal privatisation has failed the Lisbon test .	A postai privatizáció ezidáig megbukott a lisszaboni vizsgán .	2-0 3-1 4-2 0-3 1-3 5-4 6-4 7-5 8-6 9-7 10-8
A second important point is improving the situation of women .	A második lényeges kérdés a nők helyzetének javítása .	0-0 1-1 2-2 3-3 4-3 6-4 9-5 7-6 8-6 5-7 10-8
I note some worrying signs in Mr Diamandouros 's report .	Feljegyeztem Diamandouros úr jelentésében néhány nyugtalanító jelet .	0-0 1-0 7-1 6-2 5-3 8-3 9-3 2-4 3-5 4-6 10-7
In other words , we have set out the goal .	Más szóval megfogalmaztuk a célt .	1-0 0-1 2-1 3-1 4-2 5-2 6-2 7-2 8-3 9-4 10-5
We have to protect the lives and dignity of migrants .	Meg kell védenünk a migránsok életét és méltóságát .	0-0 1-1 2-1 3-2 4-3 9-4 5-5 6-6 7-7 8-7 10-8
The key word - CO2 - has already been mentioned .	A kulcsszó - CO2 - már elhangzott .	0-0 1-1 2-1 3-2 4-3 5-4 6-5 7-5 8-6 9-6 10-7
Why are they not in the Lisbon work programme either ?	Miért nem szerepelnek a lisszaboni munkaprogramban sem ?	0-0 3-1 1-2 2-2 4-2 5-3 6-4 7-5 8-5 9-6 10-7
The European Union must speak with one voice in Bali .	Az Európai Uniónak egységes véleményt kell képviselnie Balin .	0-0 1-1 2-2 3-5 4-6 5-6 6-6 7-6 8-7 9-7 10-8
The mass demonstrations and riots have made the situation uncertain .	A tömeges tüntetések és zavargások bizonytalanná tették a helyzetet .	0-0 1-1 2-2 3-3 4-4 9-5 5-6 6-6 7-7 8-8 10-9
Thank you , Mr Weber , for your magnificent report .	Köszönjük , Weber úr , az önök nagyszerű jelentését .	0-0 1-0 2-1 4-2 3-3 5-4 6-5 7-6 8-7 9-8 10-9
I therefore wish to point out the need for simplification .	Ezért szeretnék rámutatni az egyszerűsítés szükségességére .	1-0 0-1 2-1 3-1 4-2 5-2 6-3 9-4 7-5 8-5 10-6
Well , this is all part of the current climate .	Nos , ez is része a jelenlegi hangulatnak .	0-0 1-1 2-2 3-2 4-3 5-4 6-4 7-5 8-6 9-7 10-8
Malta 's contribution focused on the issue of irregular immigration .	Málta hozzászólása az illegális bevándorlás kérdésére összpontosított .	0-0 1-1 2-1 5-2 8-3 9-4 6-5 7-5 3-6 4-6 10-7
The majority of the EP applauds and supports the decision .	Az EP többsége megtapsolja és támogatja a határozatot .	0-0 3-0 4-1 1-2 2-2 5-3 6-4 7-5 8-6 9-7 10-8
Yes , let us do it on a voluntary basis .	Igen , csináljuk önkéntes alapon .	0-0 1-1 2-2 3-2 4-2 5-2 8-3 6-4 7-4 9-4 10-5
The family is indisputably the best environment for a child .	A család kétségtelenül a legjobb környezet egy gyermek számára .	0-0 1-1 2-2 3-2 4-3 5-4 6-5 8-6 9-7 7-8 10-9
The countries themselves are not happy with these aspects either .	Ezek az országok maguk sincsenek megelégedve ezekkel a jelenségekkel .	0-1 1-2 2-3 3-4 4-4 5-5 6-5 7-6 8-8 9-8 10-9
The European Social Fund provides essential support in this area .	Az Európai Szociális Alap lényeges támogatást biztosít e területen .	0-0 1-1 2-2 3-3 5-4 6-5 4-6 8-7 7-8 9-8 10-9
The resolution we will be voting on constitutes a roadmap .	A megszavazandó állásfoglalás útitervet képez .	0-0 2-1 3-1 4-1 5-1 6-1 1-2 9-3 7-4 8-4 10-5
There is no other solution , no other way forward .	Nincs más megoldás , nincs más út .	0-0 1-0 2-0 3-1 4-2 5-3 6-4 7-5 8-6 9-6 10-7
The Slovenian Parliament voted by a large majority for ratification .	A szlovén parlament nagy többséggel szavazta meg a ratifikálást .	0-0 1-1 2-2 6-3 4-4 5-4 7-4 3-5 8-7 9-8 10-9
In other words , it is also an attack system .	Más szóval , ez is egy támadó rendszer .	1-0 0-1 2-1 3-2 4-3 5-3 6-4 7-5 8-6 9-7 10-8
We have not yet taken a decision within our group .	Saját képviselőcsoportunkban még nem hoztunk döntést .	7-1 8-1 9-1 3-2 2-3 0-4 1-4 4-4 5-5 6-5 10-6
The EU has approached the Burmese authorities on many occasions .	Az EU számos alkalommal közelített a burmai hatóságokhoz .	0-0 1-1 8-2 7-3 9-3 2-4 3-4 4-5 5-6 6-7 10-8
The EIT offers a solution to this problem at European level .	Az EITI európai szinten ajánl megoldást e problémára .	0-0 1-1 9-2 8-3 10-3 2-4 3-5 4-5 6-6 7-7 11-8
I think not - and that is a good thing .	Nem hiszem - és ez jó .	2-0 0-1 1-1 3-2 4-3 5-4 6-4 7-5 8-5 9-5 10-6
It is a very important and also very interesting report .	Ez egy nagyon fontos és egyben nagyon érdekes jelentés .	0-0 1-0 2-1 3-2 4-3 5-4 6-5 7-6 8-7 9-8 10-9
The rapporteur 's work was very comprehensive and very positive .	Az előadó munkája igen átfogó , és igen pozitív volt .	0-0 1-1 2-2 3-2 5-3 6-4 7-6 8-7 9-8 4-9 10-10
As we know , the code was adopted in 1998 .	Amint mindannyian tudjuk , a kódex elfogadására 1998-ban került sor .	0-0 1-1 2-2 3-3 4-4 5-5 7-6 8-7 9-7 6-8 10-10
Every 30 seconds a child dies in Africa from malaria .	Afrikában félpercenként meghal egy gyermek maláriában .	6-0 7-0 0-1 1-1 2-1 5-2 3-3 4-4 8-5 9-5 10-6
The European Parliament ought to range itself against such injustice .	Az Európai Parlamentnek fel kellene vérteznie magát az ilyen igazságtalanság ellen .	0-0 1-1 2-2 4-3 3-4 5-5 6-6 8-8 9-9 7-10 10-11
The Court of Auditors acknowledged the progress we have made .	A Számvevőszék elismerte az általunk megtett erőfeszítéseket .	0-0 1-1 2-1 3-1 4-2 5-3 7-4 8-4 6-5 9-6 10-7
We have also increased the milk quota by 2 % .	Megemeltük a tejkvótát 2 százalékkal .	0-0 1-0 2-0 3-0 4-1 5-2 6-2 8-3 7-4 9-4 10-5
In this connection I should like to mention several points .	Ezzel kapcsolatban szeretnék megemlíteni néhány dolgot .	0-0 1-0 2-1 3-2 4-2 5-2 6-3 7-3 8-4 9-5 10-6
On this point , I find your suggestions very reasonable .	E tekintetben javaslataikat igen ésszerűnek tartom .	0-0 1-0 2-1 3-1 6-2 7-2 8-3 9-4 4-5 5-5 10-6
We are discussing the PEACE programme and not the conflict .	A PEACE programról beszélünk , nem a konfliktusról .	3-0 4-1 5-2 0-3 1-3 2-3 6-4 7-5 8-6 9-7 10-8
However , a temporary campaign is not enough in itself .	Ám egy átmeneti kampány önmagában nem elég .	0-0 1-0 2-1 3-2 4-3 5-4 8-4 9-4 6-5 7-6 10-7
Counterfeit sunglasses can cause damage to the wearer 's eyesight .	A hamisított napszemüvegek károsíthatják a viselőik látását .	0-1 1-2 2-2 3-2 4-3 5-3 6-4 7-5 8-5 9-6 10-7
Clean surface water is , of course , very important .	A tiszta felszíni víz természetesen nagyon fontos .	0-1 1-2 2-3 3-3 4-4 5-4 6-4 7-4 8-5 9-6 10-7
Do we want to incorporate the principle of voluntary return ?	Bele akarjuk-e foglalni az önkéntes visszatérés elvét ?	0-1 1-1 2-1 3-2 4-2 5-3 8-4 9-5 6-6 7-6 10-7
Europe must not become a two or more speed Europe .	Európa nem válhat két- vagy többsebességűvé .	0-0 2-1 1-2 3-2 4-2 5-3 6-4 7-5 8-5 9-5 10-6
The Dutch fleet also needs to go through a transition .	A holland flottának is keresztül kell menni egy átmeneten .	0-0 1-1 2-2 3-3 7-4 4-5 5-6 6-6 8-7 9-8 10-9
The price of fish does not compensate for the investment .	A hal ára nem kompenzálja a befektetést .	0-0 3-1 1-2 2-2 4-3 5-3 6-4 7-4 8-5 9-6 10-7
The situation regarding horses and many crops is also serious .	A lovak és számos termény helyzete is igen súlyos .	0-0 3-1 4-2 5-3 6-4 1-5 2-5 8-6 7-7 9-8 10-9
So at least that will be the view of Parliament .	Tehát legalább ez lesz a Parlament véleménye .	0-0 1-1 2-1 3-2 4-3 5-3 6-4 9-5 7-6 8-6 10-7
Secondly , we have seen a huge demand from Asia .	Másodszor hatalmas keresletet tapasztaltunk Ázsia részéről .	0-0 1-0 5-1 6-1 7-2 2-3 3-3 4-3 9-4 8-5 10-6
Third point : agricultural prices have never been so high .	A harmadik pont : a mezőgazdasági árak sohasem voltak ennyire magasak .	0-1 1-2 2-3 3-5 4-6 6-7 5-8 7-8 8-9 9-10 10-11
As I said , we will certainly need political commitment .	Mint említettem , feltétlenül szükségünk lesz politikai elkötelezettségre .	0-0 1-1 2-1 3-2 6-3 4-4 7-4 5-5 8-6 9-7 10-8
The peoples of Europe do not want deeper political integration .	Európa népei nem kívánnak mélyebb integrációt .	3-0 0-1 1-1 2-1 4-2 5-2 6-3 7-4 8-4 9-5 10-6
We must act for and on behalf of our citizens .	Polgáraink érdekében és nevében kell cselekednünk .	8-0 9-0 3-1 4-2 5-3 6-3 7-3 1-4 0-5 2-5 10-6
Six weeks ago more than 12 000 people were arrested .	Hat héttel ezelőtt több mint 12 000 embert vettek őrizetbe .	0-0 1-1 2-2 3-3 4-4 5-5 6-6 7-7 8-8 9-9 10-10
The package does , however , contain many good proposals .	A csomag tartalmaz azonban sok jó javaslatot is .	0-0 1-1 2-2 6-2 3-3 4-3 5-3 7-4 8-5 9-6 10-8
That makes Costa Rica a big country in the world .	Ez Costa Ricát nagy országgá teszi a világban .	0-0 2-1 1-2 3-2 5-3 4-4 6-4 8-6 7-7 9-7 10-8
The budgets for family planning have almost halved since 1994 .	A családtervezés költségvetése majdnem megfeleződött 1994 óta .	0-0 3-1 4-1 1-2 2-2 6-3 5-4 7-4 9-5 8-6 10-7
So , tomorrow , I am asking for your support .	Így holnap a támogatásukat kérem .	0-0 1-0 2-1 3-2 7-3 8-3 9-3 4-4 5-4 6-4 10-5
The whole international community followed with a very similar stance .	Az egész nemzetközi közösség nagyon hasonló hozzáállással követte .	0-0 1-1 2-2 3-3 6-4 7-4 8-5 5-6 9-6 4-7 10-8
A campaign-free year : what a relief that will be .	Egy kampánymentes év : milyen megkönnyebbülést jelent majd ez !	0-0 1-1 2-2 3-3 4-4 6-5 5-6 8-7 9-7 7-8 10-9
I hate the European Union , which is anti-democratic and undemocratic .	Utálom az Európai Uniót , amely antidemokratikus és demokráciaellenes .	0-0 1-0 2-1 3-2 4-3 5-4 6-5 8-6 9-7 10-8 11-9
Unlike other countries , India is now a responsible nuclear power .	Más országoktól eltérően , India mára felelős nukleáris hatalommá vált .	1-0 2-1 0-2 3-3 4-4 5-5 6-5 8-6 9-7 10-8 11-10
The international community must establish a suitable financial compensation scheme .	A nemzetközi közösségnek megfelelő pénzügyi kompenzációs rendszert kell létrehoznia .	0-0 1-1 2-2 6-3 7-4 8-5 9-6 3-7 4-8 5-8 10-9
I hope that the new Commissioner will take that opportunity .	Remélem , az új biztos élni fog az alkalommal .	0-0 1-0 2-1 3-2 4-3 5-4 7-5 6-6 8-7 9-8 10-9
Many species , including polar bears , are also threatened .	Számos faj , így a sarki medve , ugyancsak veszélyeztetett .	0-0 1-1 2-2 3-3 4-5 5-6 7-6 6-7 8-8 9-9 10-10
Before now the European records system did not function effectively .	Eddig az európai nyilvántartási rendszer nem működött hatékonyan .	0-0 1-0 2-1 3-2 4-3 5-4 7-5 6-6 8-6 9-7 10-8
The European Council has adopted the European Pact on Immigration .	Az Európai Tanács elfogadta az európai bevándorlási paktumot .	0-0 1-1 2-2 3-3 4-3 5-4 6-5 8-6 9-6 7-7 10-8
Yes indeed , Mr Schulz , that is the truth .	Igen , Schulz úr , valójában ez az igazság .	0-0 2-1 4-2 3-3 5-4 1-5 6-6 7-6 8-7 9-8 10-9
Russia is not yet the European Union 's strategic partner .	Oroszország még nem az Európai Unió stratégiai szövetségese .	0-0 1-1 3-1 2-2 4-3 5-4 6-5 8-6 7-7 9-7 10-8
This will help to reduce the number of inadmissible complaints .	Ez hozzájárul majd az elfogadhatatlan panaszok számának csökkentéséhez .	0-0 2-1 3-1 1-2 5-3 8-4 9-5 6-6 7-6 4-7 10-8
All of us care for clean air and the natural environment .	Mindannyian törődünk a tiszta levegővel és a természetes környezettel .	0-0 2-0 3-1 4-2 5-3 6-4 7-5 8-6 9-7 10-8 11-9
The free movement of criminals is a fact of life .	A bűnözők szabad mozgása ténykérdés .	0-0 4-1 1-2 2-3 3-3 8-3 5-4 6-4 7-4 9-4 10-5
The first brings together measures intended to prevent VAT fraud .	Az első egyesíti a héa-csalások megakadályozására szánt intézkedéseket .	0-0 1-1 2-2 3-2 8-4 9-4 6-5 7-5 5-6 4-7 10-8
It is a responsible step and a step towards hope .	Ez egy felelősségteljes lépés , egy lépés a remény irányába .	0-0 1-0 2-1 3-2 4-3 5-4 6-5 7-6 9-8 8-9 10-10
I want an agreement , but not any old agreement .	Megállapodást akarok , de nem akármilyen megállapodást .	2-0 3-0 0-1 1-1 4-2 5-3 6-4 7-5 8-5 9-6 10-7
Sectoral agreements may form a fundamental element in this process .	E folyamat meghatározó elemei lehetnek az ágazati megállapodások .	8-0 9-1 4-2 5-2 3-3 6-3 2-4 7-5 0-6 1-7 10-8
In next year 's budget , this is even more obvious .	A jövő évi költségvetésben ez még nyilvánvalóbb .	0-0 1-1 2-2 3-2 4-3 6-4 7-4 8-5 9-6 10-6 11-7
Secondly , the draft exempts pilot projects from the test .	Másodszor , a tervezet kivonja a kísérleti projekteket a vizsgálat alól .	0-0 1-1 2-2 3-3 4-4 5-6 6-7 8-8 9-9 7-10 10-11
Albania is not Montenegro , and Bosnia-Herzegovina is not Kosovo .	Albánia nem Montenegró , és Bosznia-Hercegovina nem Koszovó .	0-0 1-1 2-1 3-2 4-3 5-4 6-5 7-6 8-6 9-7 10-8
It is , above all , a question of language .	Ez mindenekelőtt nyelvezet kérdése .	0-0 1-0 2-1 3-1 4-1 5-1 9-2 6-3 7-3 8-3 10-4
It is not easy , but we must be clear .	Nem könnyű , de világosnak kell lennünk .	2-0 0-1 1-1 3-1 4-2 5-3 9-4 7-5 6-6 8-6 10-7
Protecting the civilian population - this is the real emergency .	A polgári lakosság védelme - ez a valódi szükséghelyzet .	1-0 2-1 3-2 0-3 4-4 5-5 6-5 7-6 8-7 9-8 10-9
In the Treaty there is no common external security policy .	A Szerződésben nem szerepel közös külső biztonságpolitika .	1-0 0-1 2-1 5-2 3-3 4-3 6-4 7-5 8-6 9-6 10-7
We need to revisit the conditions for animals during transport .	Vissza kell térnünk az állatok körülményeire a szállítás során .	1-1 0-2 2-2 3-2 4-3 7-4 5-5 6-6 9-7 8-8 10-9
What are the criteria and mechanisms for allocating these resources ?	Melyek a kritériumai és mechanizmusai e források kiosztásának ?	0-0 1-0 2-1 3-2 4-3 5-4 8-5 9-6 6-7 7-7 10-8
This is important work at both domestic and international level .	Ez hazai és nemzetközi szinten egyaránt fontos munka .	0-0 1-0 6-1 7-2 8-3 4-4 9-4 5-5 2-6 3-7 10-8
For this reason , we need positive discrimination in certain situations .	Ezért bizonyos esetekben pozitív diszkriminációt kell alkalmaznunk .	0-0 1-0 2-0 9-1 8-2 10-2 6-3 7-4 5-5 4-6 11-7
This is the only solution , there is no other .	Csak ez a megoldás , semmi más .	3-0 0-1 1-1 2-2 4-3 5-4 6-5 7-5 8-5 9-6 10-7
Therefore , I would like to put forward four proposals .	Ezért szeretnék előterjeszteni négy javaslatot .	0-0 1-0 2-1 3-1 4-1 5-2 6-2 7-2 8-3 9-4 10-5
In 2003 and 2007 forest fires ravaged Portugal and Greece .	2003-ban és 2007-ben erdőtüzek pusztítottak Portugáliában és Görögországban .	0-0 1-0 2-1 3-2 4-3 5-3 6-4 7-5 8-6 9-7 10-8
Human suffering , dead bodies , mutilated people and atrocities .	Emberi szenvedés , halottak , megcsonkított emberek és atrocitások .	0-0 1-1 2-2 3-3 4-3 5-4 6-5 7-6 8-7 9-8 10-9
However , it is imperative that its operation be improved .	A működését azonban feltétlenül javítani kell .	6-1 7-1 0-2 1-2 2-3 3-3 4-3 5-3 9-4 8-5 10-6
New firms mean new workplaces , and hence economic recovery .	Új cégek új munkahelyeket jelentenek , vagyis a gazdaság helyreállítását .	0-0 1-1 3-2 4-3 2-4 5-5 6-5 7-6 8-8 9-9 10-10
Data from the last few weeks do not engender optimism .	Az utóbbi néhány hét adatai nem adnak okot az optimizmusra .	2-0 3-1 4-2 5-3 0-4 1-4 6-5 7-5 8-9 9-9 10-10
I look forward with personal interest to your vote tomorrow .	Személyes érdeklődéssel várom holnapi szavazásukat .	4-0 3-1 5-1 0-2 1-2 2-2 6-2 9-3 7-4 8-4 10-5
It is a highly important document for protecting consumer health .	Ez egy nagyon fontos dokumentum a fogyasztók egészségének védelmében .	0-0 1-0 2-1 3-2 4-3 5-4 6-5 8-6 9-7 7-8 10-9
Either we recover together , or we will not recover .	Vagy együtt történik meg a kilábalás , vagy nem fogunk kilábalni .	0-0 3-1 1-3 2-5 4-6 5-7 8-8 6-9 7-9 9-10 10-11
Take for example Afghanistan , which several Members have mentioned .	Vegyük Afganisztán példáját , amelyet több képviselő is említett .	0-0 1-0 3-1 2-2 4-3 5-4 6-5 7-6 8-7 9-8 10-9
Their proposals weaken civil rights and the privacy of citizens .	Javaslataik gyengítik a polgári jogokat és a polgárok magánéletét .	0-0 1-0 2-1 3-3 4-4 5-5 6-6 9-7 7-8 8-8 10-9
Why is there no Commission action plan on regional policy ?	Miért nem létezik a regionális politikára vonatkozó bizottsági cselekvési terv ?	0-0 3-1 1-2 2-2 8-4 9-5 7-6 4-7 5-8 6-9 10-10
This would be an important , positive sign for Europe .	Ez egy fontos , pozitív jelzés lenne Európa számára .	0-0 3-1 4-2 5-3 6-4 7-5 1-6 2-6 9-7 8-8 10-9
The budget and the number of staff have also increased .	A költségvetés és a munkatársak száma is növekedett .	0-0 1-1 2-2 3-3 6-4 4-5 5-5 8-6 7-7 9-7 10-8
We raised the issue , but these are now merged .	Felvetettük a témát , de ezek most összeolvadtak .	0-0 1-0 2-1 3-2 4-3 5-4 6-5 7-5 8-6 9-7 10-8
The recently submitted Commission proposals will complete this legal framework .	A Bizottság nemrégiben benyújtott javaslatai ezt a jogszabályi keretet teszik teljessé .	0-0 3-1 1-2 2-3 4-4 7-5 8-7 9-8 5-9 6-10 10-11
This grim reality underlines the importance of my second question .	Ez a komor valóság kiemeli második kérdésem jelentőségét .	0-0 4-1 1-2 2-3 3-4 8-5 7-6 9-6 5-7 6-7 10-8
The head of state changes , but the citizens remain .	Az államfő változik , de a polgárok maradnak .	0-0 1-1 2-1 3-1 4-2 5-3 6-4 7-5 8-6 9-7 10-8
Fortunately , this law has not yet come into force .	A törvény szerencsére még nem lépett hatályba .	2-0 3-1 0-2 1-2 6-3 5-4 4-5 7-6 8-6 9-6 10-7
From an animal welfare perspective it is a step forward .	Állatjóléti szempontból ez előrelépést jelent .	0-0 1-0 2-0 3-0 4-1 5-2 6-2 8-3 9-3 7-4 10-5
Our committee was right , but we must go further .	Kötelezettségvállalásunk helyénvaló volt , de tovább kell lépnünk .	0-0 1-0 3-1 2-2 4-3 5-4 9-5 7-6 6-7 8-7 10-8
This would significantly ease relations between the EU and China .	Ez jelentősen javítaná az EU és Kína közti kapcsolatokat .	0-0 2-1 1-2 3-2 6-3 7-4 8-5 9-6 5-7 4-8 10-9
It helps the third countries and the European film industry .	Segíti a harmadik országokat és az európai filmipart .	0-0 1-0 2-1 3-2 4-3 5-4 6-5 7-6 8-7 9-7 10-8
That is not democracy , it is a karaoke parliament .	Ez nem demokrácia , ez egy karaoke Parlament .	0-0 1-0 2-1 3-2 4-3 5-4 6-4 7-5 8-6 9-7 10-8
The European Union must take action to reduce this influence .	Az Európai Uniónak lépnie kell ezen befolyás csökkentése érdekében .	0-0 1-1 2-2 4-3 5-3 3-4 8-5 9-6 7-7 6-8 10-9
The same applies to my hometown and the Stockholm Programme .	Ugyanez vonatkozik szülővárosomra és a stockholmi programra is .	0-0 1-0 2-1 3-1 4-2 5-2 6-3 7-4 8-5 9-6 10-8
Then , I hear what Mr Daul has to say .	Aztán hallom Daul úr mondanivalóját .	0-0 1-0 2-1 3-1 6-2 5-3 4-4 7-4 8-4 9-4 10-5
Can we expect concrete and effective measures from the Commission ?	Várhatunk-e konkrét és hatékony intézkedéseket a Bizottságtól ?	0-0 1-0 2-0 3-1 4-2 5-3 6-4 8-5 7-6 9-6 10-7
The directive has applied to new facilities since May 2008 .	Az irányelv 2008. május óta alkalmazandó az új létesítményekre .	0-0 1-1 9-2 8-3 2-4 7-4 3-5 4-5 5-7 6-8 10-9
Naturally we take the European Parliament 's concern very seriously .	Természetesen nagyon komolyan vesszük az Európai Parlament aggályait .	0-0 8-1 9-2 1-3 2-3 3-4 4-5 5-6 6-7 7-7 10-8
Therefore , my answer is a definite ' yes ' .	Ezért a válaszom egyértelmű " igen ” .	0-0 1-1 2-2 3-2 4-2 5-3 6-3 7-4 8-5 9-6 10-7
I listened with great interest to Mr Barroso 's comments earlier .	Nagy érdeklődéssel figyeltem Barroso úr korábbi észrevételeit .	3-0 2-1 4-1 0-2 1-2 7-3 6-4 10-5 8-6 9-6 11-7
We are determined to promote these principles throughout the world .	Eltökéltek vagyunk ezen alapelvek előmozdítása iránt szerte a világon .	2-0 0-1 1-1 5-2 6-3 4-4 3-5 7-6 8-7 9-8 10-9
Mr Havel also received a great deal of applause for this .	Havel úr is nagy tapsot kapott ezért .	1-0 0-1 2-2 4-3 5-3 6-4 8-4 3-5 9-6 10-6 11-7
Thank you , Mr Reinfeldt ; thank you , Cecilia .	Köszönöm , Reinfeldt úr ; köszönöm , Cecilia .	0-0 1-0 2-1 4-2 3-3 5-4 6-5 7-5 8-6 9-7 10-8
Criminals are everywhere - they do not need a visa !	Bűnözők mindenhol vannak - nekik nincs szükségük vízumra !	0-0 2-1 1-2 3-3 4-4 5-5 6-5 7-6 8-7 9-7 10-8
The European Union does not make funds available without conditions .	Az Európai Unió nem bocsát rendelkezésre finanszírozást feltételek nélkül .	0-0 1-1 2-2 3-3 4-3 5-4 7-5 6-6 9-7 8-8 10-9
Here , too , an important prerequisite has been met .	Itt is teljesült egy fontos előfeltétel .	0-0 1-1 2-1 3-1 7-2 8-2 9-2 4-3 5-4 6-5 10-6
The Euromed Free Trade Area also has a South-South dimension .	Az Euromed szabadkereskedelmi térségnek van egy dél-dél dimenziója is .	0-0 1-1 2-2 3-2 4-3 6-4 7-5 8-6 9-7 5-8 10-9
We will also monitor the EU 's Economic Recovery Plan .	Az EU gazdaságélénkítési tervét is figyelemmel fogjuk kísérni .	4-0 5-1 7-2 8-2 6-3 9-3 2-4 3-5 0-6 1-6 10-8
The Greek Communist Party voted against the European Parliament resolution .	A Görög Kommunista Párt leszavazta az Európai Parlament állásfoglalását .	0-0 1-1 2-2 3-3 4-4 5-4 6-5 7-6 8-7 9-8 10-9
However , we share the concerns of Parliament regarding political prisoners .	Ugyanakkor osztjuk a Parlament politikai foglyokkal kapcsolatos aggodalmát .	0-0 1-0 2-1 3-1 4-2 7-3 9-4 10-5 8-6 5-7 11-8
Recently a Socialist colleague of my own was banned from China .	Nemrégiben egy szocialista képviselőtársamat kitiltották Kínából .	0-0 1-1 2-2 3-3 5-3 6-4 7-4 8-4 9-5 10-5 11-6
In addition , it is not a generally acceptable position .	Ráadásul ez nem egy általánosan elfogadható álláspont .	0-0 1-0 2-0 3-1 4-1 5-2 6-3 7-4 8-5 9-6 10-7
Member States in South-Eastern Europe are faced with huge deficits .	A délkelet-európai tagállamok hatalmas deficittel küzdenek .	2-0 3-1 4-1 0-2 1-2 8-3 6-4 7-4 9-4 5-5 10-6
The High Representative will assure coordination in our external relations .	A főképviselő gondoskodik külkapcsolataink összehangolásáról .	0-0 1-1 2-1 3-2 4-3 6-3 7-3 8-3 9-3 5-4 10-5
Strategies and documents will not in themselves improve the situation .	Stratégiák és dokumentumok önmagukban nem fognak javítani a helyzeten .	0-0 1-1 2-2 5-3 6-3 4-4 3-5 7-6 8-7 9-8 10-9
This is urgent , because there are lives at risk .	A dolog sürgős , mivel emberéletek forognak kockán .	0-0 1-1 2-2 3-3 4-4 7-5 5-6 6-6 8-7 9-7 10-8
I would like to quote from one recent agency report .	Szeretnék idézni egy közelmúltbeli ügynökségi jelentést .	0-0 1-0 2-0 3-1 4-1 5-1 6-2 7-3 8-4 9-5 10-6
The Commission 's proposals are not yet legislation for us .	A Bizottság javaslatai még nem jelentenek jogszabályt számunkra .	0-0 1-1 2-2 3-2 6-3 5-4 4-5 7-6 8-7 9-7 10-8
What are the next steps in this very detailed process of surveillance ?	Mik lesznek ezen igen részletes felügyeleti folyamat következő lépései ?	0-0 1-0 5-2 6-2 7-3 8-4 11-5 9-6 3-7 4-8 12-9
