Is it not time to win respect in the Arab world , now that the situation in Iraq is continually deteriorating ?	Não será tempo de angariarmos respeito no Mundo Árabe , agora que a situação no Iraque se deteriora continuamente ?	2-0 0-1 1-1 3-2 4-3 5-4 6-5 7-6 8-6 10-7 9-8 11-9 12-10 13-11 14-12 15-13 16-14 17-15 18-16 20-17 19-18 21-19
The European Commission is right to propose a revision of the existing Directive , which aims to restrict this air pollution .	A Comissão Europeia tem razão em propor uma revisão da Directiva existente , que visa limitar esta poluição atmosférica .	0-0 2-1 1-2 3-3 4-4 5-5 6-6 7-7 8-8 9-9 10-9 12-10 11-11 13-12 14-13 15-14 16-14 17-15 18-16 20-17 19-18 21-19
The UNDP , which does have some knowledge of the matter , has raised a problem : the right to democracy .	O PNUD , que possui algum conhecimento da matéria , levantou um problema : o direito à democracia .	0-0 1-1 2-2 3-3 4-4 5-4 6-5 7-6 8-7 9-7 10-8 11-9 12-10 13-10 14-11 15-12 16-13 17-14 18-15 19-16 20-17 21-18
At the same time , however , we have to think about what we can do for the people of Turkmenistan .	Ao mesmo tempo , porém , temos de pensar no que poderemos fazer pelo próprio povo do Turquemenistão .	0-0 1-0 2-1 3-2 4-3 5-4 6-5 7-6 8-6 9-7 10-8 11-8 12-10 13-11 14-11 15-12 16-13 17-14 18-15 19-16 20-17 21-18
The Presidency intends to propose further discussions on all these matters in the course of the final meetings of the IGC .	A Presidência tenciona propor novas discussões sobre todos estes assuntos no decorrer das últimas sessões da CIG .	0-0 1-1 2-2 3-2 4-3 5-4 6-5 7-6 8-7 9-8 10-9 11-10 12-10 13-11 14-12 15-12 16-13 17-14 18-15 19-15 20-16 21-17
This is the request made by ECOWAS at New York , and this request must be supported by the European Union .	É essa a solicitação feita pela ECOWAS em Nova Iorque , e tal solicitação deve ser apoiada pela União Europeia .	1-0 0-1 2-2 3-3 4-4 5-5 6-6 7-7 8-8 9-9 10-10 11-11 12-12 13-13 14-14 15-15 16-16 17-17 18-17 20-18 19-19 21-20
That was too quickly and too soon to answer the questions that the Commission presented to Parliament in its Green Paper .	Isso foi demasiado rápido e demasiado cedo para responder às questões que a Comissão colocou ao Parlamento no seu Livro Verde .	0-0 1-1 2-2 3-3 4-4 5-5 6-6 7-7 8-8 9-9 10-10 11-11 12-12 13-13 14-14 15-15 16-16 17-17 18-18 20-19 19-20 21-21
At present , this organisation is far too bureaucratic and not in tune with the geopolitical realities of the 21st century .	Presentemente , essa organização é demasiado burocrática e não está em sintonia com as realidades geopolíticas do século XXI .	0-0 1-0 2-1 3-2 4-3 5-4 6-5 7-5 8-6 9-7 10-8 11-10 12-11 13-12 14-13 16-14 15-15 17-16 18-16 20-17 19-18 21-19
However , to be frank , it is clear that the Member States are not prepared to accept any other solution .	Contudo , para ser franco , é óbvio que os Estados-Membros não estão preparados para aceitar qualquer outra solução .	0-0 1-1 2-2 3-3 4-4 5-5 6-6 7-6 8-7 9-8 10-9 11-10 12-10 14-11 13-12 15-13 16-14 17-15 18-16 19-17 20-18 21-19
In fact , the three institutions have , for the first time , established a common definition of co-regulation and self-regulation .	De facto , as três Instituições estabeleceram , pela primeira vez , uma definição comum de co-regulação e auto-regulação .	0-0 1-1 2-2 3-3 4-4 5-5 6-6 13-6 7-7 8-8 9-8 10-9 11-10 12-11 14-12 16-13 15-14 17-15 18-16 19-17 20-18 21-19
I will quickly conclude by mentioning the last two points of our programme : the economy and quality of life .	Termino rapidamente , recordando os dois últimos pontos do nosso programa : a economia e a qualidade de vida .	0-0 1-0 3-0 2-1 4-3 5-3 6-4 8-5 7-6 9-7 10-8 11-9 12-10 13-11 14-12 15-13 16-14 17-16 18-17 19-18 20-19
It is clear that each country has different priorities in terms of the different economic sectors it wishes to protect .	É evidente que cada país tem prioridades diferentes relativamente aos diversos sectores económicos que pretende proteger .	0-0 1-0 2-1 3-2 4-3 5-4 6-5 8-6 7-7 9-8 10-8 11-9 12-9 13-10 15-11 14-12 16-13 17-14 18-14 19-15 20-16
Mr President , it is an awkward situation , this tenth anniversary of the elections of the NLD in Burma .	Senhor Presidente , é uma situação amarga , este décimo aniversário das eleições do NLD na Birmânia .	0-0 1-1 2-2 3-3 4-3 5-4 7-5 6-6 8-7 9-8 10-9 11-10 12-11 13-11 14-12 15-13 16-13 17-14 18-15 19-16 20-17
Notwithstanding the takeovers and mergers in the private sector , there is still far too much fragmentation in this area .	Independentemente das fusões e aquisições no sector privado , existe ainda demasiada fragmentação neste sector .	0-0 1-1 4-2 3-3 2-4 5-5 6-5 8-6 7-7 9-8 10-9 11-9 12-10 13-11 14-11 15-11 16-12 17-13 18-13 19-14 20-15
It reflects our economic interests , trade and the external dimension of the single market , including our agricultural policy .	Reflecte os nossos interesses económicos , a dimensão comercial e externa do mercado único , incluindo a nossa política agrícola .	0-0 1-0 2-2 4-3 3-4 5-5 8-6 10-7 6-8 7-9 9-10 11-11 12-11 14-12 13-13 15-14 16-15 17-17 19-18 18-19 20-20
In speaking of Lisbon we are also speaking of the new method of coordination , the method of open coordination .	Quando falamos de Lisboa falamos também do novo método de coordenação , o método de coordenação aberto .	0-0 1-1 2-2 3-3 4-4 5-4 7-4 6-5 8-6 9-6 10-7 11-8 12-9 13-10 14-11 15-12 16-13 17-14 19-15 18-16 20-17
The documents adopted by the Commission today are , as the President of the Commission emphasised , proposals for consultation .	Os documentos hoje adoptados pela Comissão são , como o salientou o Presidente da Comissão , propostas para consulta .	0-0 1-1 6-2 2-3 3-4 4-4 5-5 7-6 8-7 9-8 10-9 15-10 11-12 12-13 13-13 14-14 16-15 17-16 18-17 19-18 20-19
At present there is some imagination but little action , given the extensive nature of Annex IV of the Treaty .	Actualmente existe alguma imaginação mas pouca acção , dado o carácter extensivo do Anexo IV do Tratado .	0-0 1-0 2-1 3-1 4-2 5-3 6-4 7-5 8-6 9-7 10-8 11-9 13-10 12-11 14-12 15-13 16-14 17-15 18-15 19-16 20-17
The coordinator of the Aventinus projects has confirmed that Polygon was not used in either Aventinus I or Aventinus II .	O coordenador dos projectos Aventinus confirmou que o Polygon não era utilizado nem no Aventinus I nem no Aventinus II .	0-0 1-1 2-2 3-2 5-3 4-4 6-5 7-5 8-6 9-8 11-9 10-10 12-11 14-12 13-13 15-14 16-15 17-16 18-18 19-19 20-20
This will give a green light to secret services to put under surveillance people whose activities are entirely democratic and legal .	Isto dará luz verde aos serviços secretos para colocarem sob vigilância pessoas cujas actividades são totalmente democráticas e legais .	0-0 1-1 2-1 5-2 4-3 6-4 8-5 7-6 9-7 10-8 11-9 12-10 13-11 14-12 15-13 16-14 17-15 18-16 19-17 20-18 21-19
This is a problem which , as several Members of Parliament have said , does not only exist in Africa .	Este é um problema que , como afirmaram muitos membros do Parlamento , não existe apenas em África .	0-0 1-1 2-2 3-3 4-4 5-5 6-6 11-7 12-7 7-8 8-9 9-10 10-11 13-12 14-13 15-13 17-14 16-15 18-16 19-17 20-18
This may lead to the adoption of a regulation exempting certain categories of aid from the obligation of prior notification .	Isto poderá levar à adopção de um regulamento isentando determinadas categorias de ajudas da obrigação de notificação prévia .	0-0 1-1 2-2 3-3 4-3 5-4 6-5 7-6 8-7 9-8 10-9 11-10 12-11 13-12 14-13 15-13 16-14 17-15 19-16 18-17 20-18
A policy which respects and protects the environment , a policy which will create the foundations for humane living conditions .	Uma política que respeite e proteja o ambiente , uma política que crie a base para condições de vida humanas .	0-0 1-1 2-2 3-3 4-4 5-5 6-6 7-7 8-8 9-9 10-10 11-11 12-12 13-12 14-13 15-14 16-15 19-16 18-18 17-19 20-20
It was not an easy task , for the European Union left for Doha with an ambitious , broad agenda .	Não foi um resultado fácil , porque a União Europeia partiu para Doha com uma agenda ambiciosa e ampla .	2-0 0-1 1-1 3-2 4-4 5-4 6-5 7-6 8-7 10-8 9-9 11-10 12-11 13-12 14-13 15-14 19-15 16-16 17-17 18-18 20-19
When they came for the trade unionists , I did not speak out because I was not a trade unionist .	Quando perseguiram os sindicalistas , não protestei porque não era sindicalista .	0-0 1-1 2-1 3-1 4-2 5-3 6-3 7-4 10-5 8-6 9-6 11-6 12-6 14-6 13-7 16-8 15-9 17-10 18-10 19-10 20-11
In particular , the Commission wishes to tackle the mid-term review of the CAP and the reform of the CFP .	Em especial , a Comissão pretende abordar a revisão intercalar da PAC e a reforma da PCP .	0-0 1-1 2-2 3-3 4-4 5-5 6-5 7-6 8-7 10-8 9-9 11-10 12-10 13-11 14-12 15-13 16-14 17-15 18-15 19-16 20-17
Every life is important and sacred to us , but the situation in Indonesia has already claimed thousands of lives .	Cada vida é para nós importante e sagrada , mas a situação na Indonésia já fez milhares de mortos .	0-0 1-1 2-2 6-3 7-4 3-5 4-6 5-7 8-8 9-9 10-10 11-11 12-12 13-13 15-14 14-15 17-16 18-17 16-18 19-18 20-19
It has been a test of endurance and , as he says , it is a complex and technical report .	Foi um teste de resistência e , como ele diz , este é um relatório técnico e complexo .	0-0 1-0 2-0 3-1 4-2 5-3 6-4 7-5 8-6 9-7 10-8 11-9 12-10 13-11 14-12 15-13 19-14 18-15 17-16 16-17 20-18
Mr President , the Commission formulated three priorities in its Annual Policy Strategy : enlargement , security and sustainable development .	Senhor Presidente , a Comissão formulou três prioridades na sua Estratégia Política Anual : alargamento , segurança e desenvolvimento sustentável .	0-0 1-1 2-2 3-3 4-4 5-5 6-6 7-7 8-8 9-9 12-10 11-11 10-12 13-13 14-14 15-15 16-16 17-17 19-18 18-19 20-20
These four principles strengthen the application of the Pact and explicitly incorporate the effects of cyclical development into budgetary monitoring .	Estes quatro princípios reforçam a aplicação do Pacto e incorporam explicitamente os efeitos da evolução cíclica na vigilância orçamental .	0-0 1-1 2-2 3-3 4-4 5-5 6-6 7-6 8-7 9-8 11-9 10-10 12-11 13-12 14-13 16-14 15-15 17-16 19-17 18-18 20-19
Mr President , I regret that the concept of social dialogue has been jettisoned by the Commission with this directive .	Senhor Presidente , lamento que o conceito de diálogo social tenha sido abandonado pela Comissão com esta directiva .	0-0 1-1 2-2 3-3 4-3 5-4 6-5 7-6 8-7 10-8 9-9 11-10 12-11 13-12 14-13 15-13 16-14 17-15 18-16 19-17 20-18
Of course , the principle of the six-monthly rotation of the Presidency of the Union will have to be changed .	Evidentemente , o princípio da rotação semestral da Presidência da União terá de ser alterado .	0-0 1-0 2-1 3-2 4-3 5-4 6-4 8-5 7-6 9-7 10-7 11-8 12-9 13-9 14-10 15-11 16-11 17-12 18-13 19-14 20-15
As to your question concerning the timing , our analysis of what is a very extensive file is well advanced .	Em relação à sua questão sobre a calendarização , a nossa análise daquele que é um dossier muito vasto está muito avançada .	0-0 1-2 2-3 3-4 4-5 5-6 6-7 7-8 8-10 9-11 10-12 11-13 12-14 13-15 16-16 14-17 15-18 17-19 18-20 19-21 20-22
So , ACP 0 % , normal rate 24 % , mediator 's proposal 25 000 tonnes at 12 % .	Assim , ACP 0 % , tarifa normal 24 % , proposta do mediador : 25 000 toneladas a 12 % .	0-0 1-1 2-2 3-3 4-4 5-5 7-6 6-7 8-8 9-9 10-10 13-11 12-12 11-13 14-15 15-16 16-17 17-18 18-19 19-20 20-21
As the promotion of cultural diversity is included in the EC Treaty , it naturally forms part of our trade policy .	Estando a promoção da diversidade cultural incluída no Tratado CE , faz parte , naturalmente , da nossa política comercial .	0-0 1-1 2-2 3-3 5-4 4-5 7-6 8-7 9-7 11-8 10-9 12-10 13-11 15-11 16-12 14-14 17-16 18-17 20-18 19-19 21-20
The very positive outcome of the referendum in Malta is an auspicious sign and an incentive to even greater efforts .	O resultado muito positivo do referendo de Malta constitui um sinal prometedor e um incentivo para esforços ainda maiores .	0-0 3-1 1-2 2-3 4-4 5-4 6-5 7-6 8-7 9-8 10-9 12-10 11-11 13-12 14-13 15-14 16-15 19-16 17-17 18-18 20-19
The technology of electronic identification for sheep and goats has progressed to such a stage that it can now be applied .	A tecnologia da identificação electrónica de ovinos e caprinos está tão avançada que já pode ser aplicada .	0-0 1-1 2-2 4-3 3-4 5-5 6-6 7-7 8-8 10-8 9-9 12-10 13-10 14-11 15-12 18-13 16-14 17-14 19-15 20-16 21-17
Having said this , the common position incorporates a large proportion of the amendments proposed by Parliament at first reading .	Posto isso , a posição comum incorpora uma grande parte das alterações propostas pelo Parlamento em primeira leitura .	0-0 1-0 2-1 3-2 4-3 6-4 5-5 7-6 8-7 9-8 10-9 11-10 12-10 13-11 14-12 15-13 16-14 17-15 18-16 19-17 20-18
If the Council agreed with the objective of the Single European Sky , it should have adopted a different strategy .	Se o Conselho concordava com o objectivo do céu único europeu , devia ter adoptado uma estratégia diferente .	0-0 1-1 2-2 3-3 4-4 5-5 6-6 7-7 8-7 11-8 9-9 10-10 12-11 13-12 14-12 15-13 16-14 17-15 19-16 18-17 20-18
This second extension demonstrates the flexibility and willingness , the good political sense of Parliament , of the entire Parliament .	Esta segunda prorrogação demonstra a flexibilidade e a vontade , o bom-senso político do Parlamento , de todo o Parlamento .	0-0 1-1 2-2 3-3 4-4 5-5 6-6 7-8 8-9 9-10 10-11 12-11 11-12 13-13 14-14 15-15 16-16 18-17 17-18 19-19 20-20
At the same time , the environment in which monetary policy was conducted in 2002 was one of considerable uncertainty .	Ao mesmo tempo , o ambiente em que foi conduzida a política monetária em 2002 foi um ambiente de considerável incerteza .	0-0 1-0 2-1 3-2 4-3 5-4 6-5 7-6 8-7 11-8 12-9 10-11 9-12 13-13 14-14 15-15 16-16 17-18 18-19 19-20 20-21
The Commission is prepared to accept almost half the amendments passed by Parliament , which really do improve the proposal .	A Comissão está preparada para aceitar quase metade das alterações aprovadas pelo Parlamento , que melhoram efectivamente a proposta .	0-0 1-1 2-2 3-3 4-4 5-5 6-6 7-7 8-8 9-9 10-10 11-11 12-12 13-13 14-14 17-15 15-16 16-16 18-17 19-18 20-19
I think that we are in a decisive year for the integration of Europe and for the image of Europe .	Julgo que estamos num ano decisivo para a integração da Europa , para a imagem da Europa .	0-0 1-0 2-1 3-2 4-2 5-3 6-3 8-4 7-5 9-6 10-7 11-8 12-9 13-10 14-11 15-12 16-13 17-14 18-15 19-16 20-17
A new state requires a constitution , a common currency , a common court of justice and a common defence .	Um novo Estado pressupõe uma Constituição , uma moeda comum , um Tribunal de Justiça comum e uma defesa comum .	0-0 1-1 2-2 3-3 4-4 5-5 6-6 7-7 9-8 8-9 10-10 11-11 13-12 14-13 15-14 12-15 16-16 17-17 19-18 18-19 20-20
In which year that will happen none of us know , but this is one small step in that direction .	Em que ano isso acontecerá nenhum de nós sabe , mas este é um pequeno passo nessa direcção .	0-0 1-1 2-2 3-3 4-4 5-4 6-5 7-6 8-7 9-8 10-9 11-10 12-11 13-12 14-13 15-14 16-15 17-16 18-16 19-17 20-18
Madam President , the 2004 budget is an expression of the anti-grass roots , autocratic policy of the European Union .	Senhora Presidente , o orçamento de 2004 é uma expressão da política antipopular e autocrática da União Europeia .	0-0 1-1 2-2 3-3 5-4 4-6 6-7 7-8 8-9 9-10 10-10 15-11 11-12 12-12 13-13 14-14 16-15 17-15 19-16 18-17 20-18
Almost five months have passed and , over these five months , too many things have happened in those countries .	Decorreram quase cinco meses e , durante esses cinco meses , muitas coisas aconteceram naqueles países .	3-0 4-0 0-1 1-2 2-3 5-4 6-5 7-6 8-7 9-8 10-9 11-10 12-11 13-11 14-12 15-13 16-13 17-14 18-14 19-15 20-16
I agree that this is an important aspect of our development , also in the context of the wider Europe .	Concordo que este é um aspecto importante do nosso desenvolvimento , também no contexto da Europa alargada .	0-0 1-0 2-1 3-2 4-3 5-4 7-5 6-6 8-7 9-8 10-9 11-10 12-11 13-12 14-12 15-13 16-14 17-14 19-15 18-16 20-17
Madam President , this report and this debate in Parliament are , from a political point of view , quite meaningless .	Senhora Presidente , este relatório e este debate no Parlamento são , do ponto de vista político , bastante absurdos .	0-0 1-1 2-2 3-3 4-4 5-5 6-6 7-7 8-8 9-9 10-10 11-11 12-12 15-13 16-14 17-15 14-16 18-17 19-18 20-19 21-20
The report specifies that citizenship of the European Union complements and broadens national citizenship through the recognition of common rights .	O relatório especifica que a cidadania da União Europeia completa e expande a cidadania nacional através do reconhecimento dos direitos comuns .	0-0 1-1 2-2 3-3 4-5 5-6 6-6 8-7 7-8 9-9 10-10 11-11 13-13 12-14 14-15 15-16 16-17 17-18 19-19 18-20 20-21
There is always the problem and risk of indirect consequences of supporting a government in a difficult situation like this .	Existe sempre o problema e o risco das consequências indirectas de apoiar um governo numa situação difícil como esta .	0-0 1-0 2-1 3-2 4-3 5-4 6-6 7-7 9-8 8-9 10-10 11-11 12-12 13-13 14-14 15-14 17-15 16-16 18-17 19-18 20-19
This accident does not just require an effort and a strengthening of the controls and the transparency of those controls .	Este acidente não exige unicamente um esforço e um reforço dos controlos e da transparência destes controlos .	0-0 1-1 2-2 3-2 5-3 4-4 6-5 7-6 8-7 9-8 10-9 11-10 12-10 13-11 14-12 15-13 16-14 17-15 18-15 19-16 20-17
The Irish presidency has begun in a Union of 15 Member States and will end in a Union of 25 .	A Presidência irlandesa teve início numa União com 15 Estados-Membros e vai terminar numa União com 25 .	0-0 2-1 1-2 3-3 4-4 5-5 6-5 7-6 8-7 9-8 10-9 11-9 12-10 13-11 14-12 15-13 16-13 17-14 18-15 19-16 20-17
From the point of view of Parliament , this signifies a considerable improvement on the original position of the Council .	Do ponto de vista do Parlamento , isto representa uma melhoria significativa relativamente à posição inicial do Conselho .	0-0 1-0 2-1 3-2 4-3 5-4 6-5 7-6 8-7 9-8 10-9 12-10 11-11 13-12 14-13 16-14 15-15 17-16 18-16 19-17 20-18
The Irish Presidency ’ s ambition and determination are supported by the analysis and conclusions presented in the Spring report .	A ambição e a determinação da Presidência irlandesa são corroboradas pela análise e pelas conclusões apresentadas no relatório da Primavera .	0-0 5-1 6-2 7-4 3-5 4-5 2-6 1-7 8-8 9-9 10-10 11-10 12-11 13-12 14-14 15-15 16-16 19-17 17-18 18-19 20-20
In many cases , however , we have seen the European Union going in the opposite direction to this aspiration .	Em muitos casos , porém , temos visto a União Europeia caminhar na direcção oposta a esta aspiração .	0-0 1-1 2-2 3-3 4-4 5-5 6-6 7-6 8-7 9-8 11-9 10-10 12-11 13-12 14-12 16-13 15-14 17-15 18-16 19-17 20-18
The smooth and effective integration of the new Member States is one of the highest priorities of the Irish presidency .	A integração suave e eficaz dos novos Estados-Membros é umas das maiores prioridades da Presidência irlandesa .	0-0 4-1 1-2 2-3 3-4 5-5 6-5 7-6 8-7 9-7 10-8 11-9 12-10 13-10 14-11 15-12 16-13 17-13 19-14 18-15 20-16
One issue which is referred to in the van der Laan report is the whole question of the Gaza hospital .	Um assunto que é mencionado no relatório van der Laan é toda a questão do hospital de Gaza .	0-0 1-1 2-2 3-3 4-4 6-5 7-5 11-6 8-7 9-8 10-9 12-10 14-11 13-12 15-13 16-14 17-14 19-15 18-17 20-18
The possibility should exist , in certain circumstances , of freeing the distributor by means of a reintegration of the investment .	Deveria existir a possibilidade , em determinadas circunstâncias , de se libertar mediante uma reintegração do investimento .	2-0 3-1 0-2 1-3 4-4 5-5 6-6 7-7 8-8 9-9 10-11 12-11 13-12 14-12 16-13 17-14 18-15 19-15 20-16 21-17
The concentration of road , airport and port networks is causing serious congestion and environmental problems which we must prevent .	A concentração das redes rodoviárias , aeroportuárias e portuárias causam sérios problemas de congestão e graves problemas ambientais que devemos evitar .	0-0 1-1 2-2 8-3 3-4 4-5 5-6 6-7 7-8 10-9 11-10 12-13 13-14 15-16 14-17 16-18 17-19 18-19 19-20 20-21
The churches of Zimbabwe , the Lutheran World Federation and the World Council of Churches appeal to your conscience .	As igrejas do Zimbabué , a Federação Mundial Luterana e o Conselho Mundial das Igrejas apelam à sua consciência .	0-0 1-1 2-2 3-3 4-4 5-5 8-6 7-7 6-8 9-9 10-10 12-11 11-12 13-13 14-14 15-15 16-16 17-17 18-18 19-19
We could perhaps look at the potential of a protocol to protect the specific characteristic of sport in Europe .	Talvez pudéssemos analisar o potencial de um protocolo para proteger as características específicas do desporto na Europa .	2-0 0-1 1-1 3-2 4-2 5-3 6-4 7-5 8-6 9-7 10-8 11-9 12-10 14-11 13-12 15-13 16-14 17-15 18-16 19-17
The European Council represents the interests of the fifteen governments of the Union and has very strong legislative powers .	O Conselho Europeu representa os interesses dos quinze governos da União e tem poderes legislativos muito fortes .	0-0 2-1 1-2 3-3 4-4 5-5 6-6 7-6 8-7 9-8 10-9 11-9 12-10 13-11 14-12 18-13 17-14 15-15 16-16 19-17
Proven cases of doping in sporting competitions have diminished the reputation of many sports in the eyes of the public .	Casos comprovados de dopagem em competições desportivas diminuíram a reputação de numerosos desportos aos olhos do público .	1-0 0-1 2-2 3-3 4-4 6-5 5-6 7-7 8-7 9-8 10-9 11-10 12-11 13-12 15-13 16-14 17-15 18-15 19-16 20-17
All of them are important , all of them require an innovative and open attitude on the part of policy makers .	Todas elas são importantes , todas elas exigem uma atitude inovadora e aberta da parte dos decisores políticos .	0-0 2-1 3-2 4-3 5-4 6-5 8-6 9-7 10-8 14-9 11-10 12-11 13-12 15-13 16-13 17-14 18-15 20-16 19-17 21-18
He stated that the Irish tax cuts made over the past three years have been contractionary , not inflationary .	Afirmou que as reduções fiscais irlandesas efectuadas nos três últimos anos foram anti ­ inflacionárias e não inflacionárias .	0-0 1-0 2-1 3-2 6-3 5-4 4-5 7-6 8-7 9-7 11-8 10-9 12-10 13-11 14-11 15-14 16-15 17-16 18-17 19-18
The possibility of reliable comparison of statistical information on the accounts also increases the transparency of our public administrations .	A possibilidade de fazer comparações fiáveis de informação estatística sobre as contas também aumenta a transparência das nossas administrações públicas .	0-0 1-1 2-2 4-4 3-5 5-6 7-7 6-8 8-9 9-10 10-11 11-12 12-13 13-14 14-15 15-16 16-17 18-18 17-19 19-20
Madam President , I should be very pleased if the European Commission were given more money for its budget .	Senhora Presidente , ficaria muito satisfeito se a Comissão Europeia pudesse dispor de mais dinheiro no seu orçamento .	0-0 1-1 2-2 3-3 4-3 5-3 6-4 7-5 8-6 9-7 11-8 10-9 12-10 13-11 14-13 15-14 16-15 17-16 18-17 19-18
I am the Prime Minister of a country which has opened up many markets , which has liberalised and deregulated .	Sou Primeiro Ministro de um país que abriu muitos mercados , que liberalizou e desregulamentou .	0-0 1-0 3-1 4-2 5-3 6-4 7-5 8-6 9-7 10-7 11-7 12-8 13-9 14-10 15-11 16-12 17-12 18-13 19-14 20-15
Madam President , I want to speak on the item ' statute and financing of European political parties ' .	Senhora Presidente , gostaria de intervir sobre o ponto " estatuto e financiamento dos partidos políticos europeus " .	0-0 1-1 2-2 3-3 4-3 5-4 6-5 7-6 8-7 9-8 10-9 11-10 12-11 13-12 14-13 17-14 16-15 15-16 18-17 19-18
We have also begun three studies , one of which will specifically examine the development of new advertising techniques .	Lançámos também três estudos , um dos quais analisará especificamente o desenvolvimento das novas técnicas publicitárias .	0-0 1-0 3-0 2-1 4-2 5-3 6-4 7-5 8-6 9-7 10-8 12-8 11-9 13-10 14-11 15-12 16-13 18-14 17-15 19-16
The use of stem cells from one ' s own body or if necessary from residual embryos , is defensible .	A utilização de células estaminais do próprio corpo , ou , se necessário , de embriões supranumerários , é defensável .	0-0 1-1 2-2 4-3 3-4 5-5 7-5 8-5 9-6 10-7 11-9 12-11 13-12 14-14 16-15 15-16 17-17 18-18 19-19 20-20
Mr President , the surprising result of the vote on the Fiori report can be interpreted in various ways .	Senhor Presidente , o resultado surpreendente da votação sobre o relatório Fiori pode ser interpretado de diversas maneiras .	0-0 1-1 2-2 3-3 5-4 4-5 6-6 7-6 8-7 9-8 10-9 12-10 11-11 13-12 14-13 15-14 16-15 17-16 18-17 19-18
The Financial Perspectives are expressed in standard euros , while the programming works in current euros for each year .	As Perspectivas Financeiras estão expressas em euros constantes , enquanto a programação trabalha com euros correntes de cada ano .	0-0 2-1 1-2 3-3 4-4 5-5 7-6 6-7 8-8 9-9 10-10 11-11 12-12 13-13 15-14 14-15 16-16 17-17 18-18 19-19
The wretched economic and social situation has exacerbated the political , cultural and national conflicts that characterise the area .	A miserável situação económica e social agravou os conflitos políticos , culturais e nacionais que caracterizam a região .	0-0 1-1 5-2 2-3 3-4 4-5 6-6 7-6 8-7 14-8 9-9 10-10 11-11 12-12 13-13 15-14 16-15 17-16 18-17 19-18
