The constant postponement of the referendum on the future of the Western Sahara is unacceptable .	O permanente adiamento do referendo sobre o futuro do Sara Ocidental é inadmissível .	0-0 1-1 2-2 3-3 4-3 5-4 6-5 7-6 8-7 9-8 10-8 12-9 11-10 13-11 14-12 15-13
However , the United States have not wanted to enter into this type of discussion .	Contudo , os Estados Unidos não quiseram entrar neste tipo de discussão .	0-0 1-1 2-2 4-3 3-4 6-5 5-6 7-6 8-6 9-7 10-7 11-8 12-9 13-10 14-11 15-12
The implementation of MEDA has been subject to criticism , some justified , some not .	A implementação do MEDA tem sido alvo de críticas , algumas justificadas , outras não .	0-0 1-1 2-2 3-3 4-4 5-5 6-6 7-7 8-8 9-9 10-10 11-11 12-12 13-13 14-14 15-15
All seven defendants were absolved of charges of torture and belonging to an armed group .	Os sete arguidos foram absolvidos das acusações de tortura e de pertencerem a um grupo armado .	0-0 1-1 2-2 3-3 4-4 5-5 6-6 7-7 8-8 9-9 10-11 11-12 12-13 14-14 13-15 15-16
The value of fundamental human rights was placed above the value of classic state sovereignty .	O valor dos direitos humanos fundamentais foi colocado acima do clássico valor da soberania estatal .	0-0 1-1 2-2 5-3 4-4 3-5 6-6 7-7 8-8 9-9 12-10 10-11 11-12 14-13 13-14 15-15
Yesterday , in the General Affairs Council , these documents were voted on and approved .	Ontem , no Conselho de Assuntos Gerais , estes documentos foram votados e aprovados .	0-0 1-1 2-2 3-2 6-3 5-5 4-6 7-7 8-8 9-9 10-10 11-11 12-11 13-12 14-13 15-14
The history of Paraguay is one of the saddest and most unjust in Latin America .	A história do Paraguai é uma das mais tristes e injustas da América Latina .	0-0 1-1 2-2 3-3 4-4 5-5 6-6 7-6 10-7 8-8 9-9 11-10 12-11 14-12 13-13 15-14
With no such foundation , the Central Bank is not independent , it is isolated .	Sem esta premissa , o Banco Central não é independente , fica isolado .	0-0 1-0 2-1 3-2 4-3 5-4 7-5 6-6 9-7 8-8 10-9 11-10 12-11 13-11 14-12 15-13
The importation and exportation of crimes does not recognise the EU ' s external borders .	A exportação e importação de crimes não conhecem as fronteiras externas da UE .	0-0 3-1 2-2 1-3 4-4 5-5 6-6 7-6 8-7 9-8 14-9 13-10 11-11 12-11 10-12 15-13
The time-frame currently being proposed , two or three years , is far too long .	O prazo agora proposto , dois ou três anos , é demasiadamente longo .	0-0 1-1 2-2 3-3 4-3 5-4 6-5 7-6 8-7 9-8 10-9 11-10 12-11 13-11 14-12 15-13
The use of these weapons has already , therefore , been condemned in international law .	A utilização dessas armas já foi , portanto , condenada no direito internacional .	0-0 1-1 2-2 3-2 4-3 6-4 5-5 7-6 8-7 9-8 10-9 11-9 12-10 14-11 13-12 15-13
That is a development to which the Swedish Christian Democrats do not wish to contribute .	Esta é uma evolução em que os democratas-cristãos suecos não desejam colaborar .	0-0 1-1 2-2 3-3 4-4 5-5 6-6 8-7 9-7 7-8 10-9 11-9 12-10 13-10 14-11 15-12
The conclusions of these experts ' mission should be available by the end of February .	As conclusões da missão destes peritos deverão estar disponíveis até ao fim de Fevereiro .	0-0 1-1 2-2 5-2 6-3 3-4 4-5 7-6 8-7 9-8 10-9 11-10 12-11 13-12 14-13 15-14
The threats of the twenty-first century reside in a combination of technical development and competition .	As ameaças do século XXI residem numa combinação de desenvolvimento técnico e competitividade .	0-0 1-1 2-2 3-2 5-3 4-4 6-5 7-6 8-6 9-7 10-8 12-9 11-10 13-11 14-12 15-13
The strategy adopted in Lisbon is an important milestone in the development of the EU .	A estratégia adoptada em Lisboa representa um marco importante no desenvolvimento da União .	0-0 1-1 2-2 3-3 4-4 5-5 6-6 8-7 7-8 9-9 10-9 11-10 12-11 13-11 14-12 15-13
Madam President , the Dutch version of Amendment No 38 has not been correctly worded .	Senhora Presidente , a versão neerlandesa da alteração 38 não está correctamente formulada .	0-0 1-1 2-2 3-3 5-4 4-5 6-6 7-7 8-7 9-8 11-9 10-10 12-10 13-11 14-12 15-13
I would not say that the majority of the Swedish people is a small group .	Eu não diria que a maioria do povo sueco constitui um pequeno grupo .	0-0 2-1 1-2 3-2 4-3 5-4 6-5 7-6 8-6 10-7 9-8 11-9 12-10 13-11 14-12 15-13
The idea of annual instalments for the payment of one-off amounts is a possible solution .	A ideia de prestações anuais para o pagamento de montantes únicos é uma solução possível .	0-0 1-1 2-2 4-3 3-4 5-5 6-6 7-7 8-8 10-9 9-10 11-11 12-12 14-13 13-14 15-15
The Treaty of Amsterdam explicitly includes gender equality among the objectives of the European Community .	O Tratado de Amesterdão inclui explicitamente a igualdade entre géneros nos objectivos da Comunidade Europeia .	0-0 1-1 2-2 3-3 5-4 4-5 7-7 8-8 6-9 9-10 10-11 11-12 12-12 14-13 13-14 15-15
In Africa , 20 % of the population live in countries affected by armed conflict .	Em África , 20 % da população vive em países afectados por conflitos armados .	0-0 1-1 2-2 3-3 4-4 5-5 6-5 7-6 8-7 9-8 10-9 11-10 12-11 14-12 13-13 15-14
The European Union has been intensively involved in trying to manage and prevent this crisis .	A União Europeia tem estado intensamente envolvida na tentativa de gerir e prevenir esta crise .	0-0 2-1 1-2 3-3 4-4 5-5 6-6 7-7 8-8 9-9 10-10 11-11 12-12 13-13 14-14 15-15
We discussed the matter of precedents at length and the two precedents were rather interesting .	Discutimos longamente a questão dos precedentes e ambos os precedentes eram bastante interessantes .	0-0 1-0 6-1 7-1 2-2 3-3 4-4 5-5 8-6 10-7 9-8 11-9 12-10 13-11 14-12 15-13
The proposal also allows the free movement of insects , fish and some other animals .	A proposta permite também a livre circulação de insectos , peixes e outros animais .	0-0 1-1 3-2 2-3 4-4 5-5 6-6 7-7 8-8 9-9 10-10 11-11 12-12 13-12 14-13 15-14
It was rather enthusiastic , but vague in terms of the impact of certain actions .	Era bastante entusiástico , mas vago em termos do impacto de certas acções .	0-0 1-0 2-1 3-2 4-3 5-4 6-5 7-6 8-7 9-8 10-8 11-9 12-10 13-11 14-12 15-13
It would be more sensible to buy these animals in order to destroy the meat .	Seria mais sábio a compra desses animais para destruição da carne .	0-0 1-0 2-0 3-1 4-2 5-3 6-4 7-5 8-6 9-7 10-7 11-7 12-8 13-9 14-10 15-11
The most important measure for this re-assessment is described in Article 14 of the Protocol .	A principal medida para esta reavaliação é descrita no artigo 14º do protocolo .	0-0 1-1 2-1 3-2 4-3 5-4 6-5 7-6 8-7 9-8 10-9 11-10 12-11 13-11 14-12 15-13
I think that the Europe of the future is also a Europe of the workers .	Penso que a Europa do futuro é também uma Europa dos trabalhadores .	0-0 1-0 2-1 3-2 4-3 5-4 6-4 7-5 8-6 9-7 10-8 11-9 12-10 13-10 14-11 15-12
It could be challenged in the WTO and would have enormous environmental and economic consequences .	Poderia ser contestada pela OMS e teria enormes consequências ambientais e económicas .	0-0 1-0 2-1 3-2 4-3 5-3 6-4 7-5 8-6 9-6 10-7 14-8 11-9 12-10 13-11 15-12
It simply means that the text is inadequate on some points and ambiguous on others .	Significa apenas que o texto é insuficiente sobre certos pontos e ambíguo sobre outros .	0-0 2-0 1-1 3-2 4-3 5-4 6-5 7-6 8-7 9-8 10-9 11-10 12-11 13-12 14-13 15-14
Mr President , the peripheral regions of the European Union are in a vulnerable situation .	Senhor Presidente , as regiões ultraperiféricas da União Europeia encontram-se numa situação vulnerável .	0-0 1-1 2-2 3-3 5-4 4-5 6-6 7-6 9-7 8-8 10-9 11-10 12-10 14-11 13-12 15-13
Madam President , Mr President-in-Office of the Council , the images from Göteborg were alarming .	Senhora Presidente , Senhor Presidente do Conselho , as imagens de Gotemburgo foram assustadoras .	0-0 1-1 2-2 3-3 4-4 5-5 6-5 7-6 8-7 9-8 10-9 11-10 12-11 13-12 14-13 15-14
The legal framework of the internal market also plays an important role in this field .	O quadro jurídico do mercado interno também desempenha um papel importante neste domínio .	0-0 2-1 1-2 3-3 4-3 6-4 5-5 7-6 8-7 9-8 11-9 10-10 12-11 13-11 14-12 15-13
This recommendation should be seen as a first stage in the development of that framework .	Esta recomendação deve ser encarada como um primeiro passo para o desenvolvimento desse quadro .	0-0 1-1 2-2 3-3 4-4 5-5 6-6 7-7 8-8 9-9 10-10 11-11 12-12 13-12 14-13 15-14
The best rate of transposition is in Denmark , with an average of 98 % .	O melhor índice de transposição pertence à Dinamarca , com uma média de 98 % .	0-0 1-1 2-2 3-3 4-4 5-5 6-6 7-7 8-8 9-9 10-10 11-11 12-12 13-13 14-14 15-15
At last we can create a truly uniform European area of safety in the European skies .	Podemos criar finalmente um espaço de segurança verdadeiramente comum no céu europeu .	2-0 3-0 4-1 0-2 1-2 5-3 9-4 10-5 11-6 6-7 7-8 12-9 13-9 15-10 14-11 16-12
No one has the right to murder in the attempt to achieve a political objective .	Ninguém tem o direito de matar na tentativa de atingir um objectivo político .	0-0 1-0 2-1 3-2 4-3 5-4 6-5 7-6 8-6 9-7 10-8 11-9 12-10 14-11 13-12 15-13
This is an inalienable right not only guaranteed in law but also defended in practice .	Este é um direito inalienável , não apenas garantido na lei mas também defendido na prática .	0-0 1-1 2-2 4-3 3-4 5-6 6-7 7-8 8-9 9-10 10-11 11-12 12-13 13-14 14-15 15-16
The difference between our two institutions is that we act as a Parliament should act .	A diferença entre as nossas duas Instituições é que nós agimos como deve agir um parlamento .	0-0 1-1 2-2 3-4 4-5 5-6 6-7 7-8 8-9 9-10 10-11 13-12 14-13 11-14 12-15 15-16
They are an important source of employment and a breeding ground for new business concepts .	Constituem uma importante fonte de emprego e um viveiro de novos conceitos empresariais .	0-0 1-0 2-1 3-2 4-3 5-4 6-5 7-6 8-7 9-8 10-8 11-9 12-10 14-11 13-12 15-13
For us , the preservation of Article 3 is an essential part of this reform .	Para nós , preservar o artigo 3º é um elemento fundamental desta reforma .	0-0 1-1 2-2 4-3 3-4 5-5 6-5 7-6 8-7 9-8 11-9 10-10 12-11 13-11 14-12 15-13
It should be remembered that the most efficient form of government is the centralised dictatorship .	Não devemos esquecer que a forma de governo mais eficiente é a ditadura centralizada .	0-0 1-1 2-1 3-2 4-3 5-4 8-5 9-6 10-7 6-8 7-9 11-10 12-11 14-12 13-13 15-14
I hope that this report will be followed by the rapid adoption of a regulation .	Espero que este relatório seja seguido pela rápida adopção de um regulamento .	0-0 1-0 2-1 3-2 4-3 5-4 6-4 7-5 8-6 9-6 10-7 11-8 12-9 13-10 14-11 15-12
This was the first piece of Community legislation in the field of industrial risk management .	Esta foi a primeira peça da legislação comunitária no campo da gestão de riscos industriais .	0-0 1-1 2-2 3-3 4-4 5-5 7-6 6-7 8-8 10-9 9-10 11-10 14-11 13-13 12-14 15-15
It is discussed in Daíl Éireann and is a key component of our annual budget .	É discutido no Dail Éireann , a Câmara Baixa do parlamento irlandês , e é uma componente fundamental do nosso orçamento anual .	0-0 1-0 2-1 3-2 4-3 5-4 6-13 7-14 8-15 10-16 9-17 11-18 12-19 14-20 13-21 15-22
Neither Sellafield nor la Hague was designed to withstand the impact of a commercial jet .	Nem Sellafield nem La Hague foram concebidas para aguentar o impacto de um avião comercial .	0-0 1-1 2-2 3-3 4-4 5-5 6-6 7-7 8-8 9-9 10-10 11-11 12-12 14-13 13-14 15-15
Mr President , I have made so many speeches that I have lost my voice .	Senhor Presidente , fiz tantas intervenções que perdi a voz .	0-0 1-1 2-2 3-3 4-3 5-3 6-4 7-4 8-5 9-6 10-7 11-7 12-7 13-7 14-9 15-10
Mr President , I want to make a point on the European Council in Ghent .	Senhor Presidente , gostaria de tecer um comentário acerca do Conselho Europeu de Gand .	0-0 1-1 2-2 3-3 4-3 5-4 6-5 7-6 8-7 9-8 10-9 12-10 11-11 13-12 14-13 15-14
It calls on Parliament to adopt criteria for the definition of sensitive information and documents .	Pede ao Parlamento que aprove critérios para a definição de informações e de documentos sensíveis .	0-0 1-0 2-1 3-2 4-3 5-4 6-5 7-6 8-7 9-8 10-9 12-10 13-11 14-13 11-14 15-15
The first objective is to correct the deficiencies observed with the implementation of existing legislation .	O primeiro objectivo é corrigir as deficiências observadas na aplicação da legislação existente .	0-0 1-1 2-2 3-3 4-4 5-4 6-5 7-6 8-7 9-7 10-8 11-9 12-10 14-11 13-12 15-13
The most important exception to general human progress is the inability to prevent violent conflicts .	A excepção mais importante ao progresso geral da humanidade é a incapacidade de evitar conflitos violentos .	0-0 3-1 1-2 2-3 4-4 7-5 5-6 6-8 8-9 9-10 10-11 11-12 12-13 14-14 13-15 15-16
Without the European Union , we would not be as advanced today as we are .	Sem a União Europeia , não estaríamos hoje tão adiantados como estamos .	0-0 1-1 3-2 2-3 4-4 7-5 5-6 6-6 8-6 11-7 9-8 10-9 12-10 13-11 14-11 15-12
It is strange , but we are witnessing a veritable inversion of the Community method .	É paradoxal , mas estamos perante uma verdadeira inversão do método comunitário .	0-0 1-0 2-1 3-2 4-3 5-4 6-4 7-5 8-6 9-7 10-8 11-9 12-9 14-10 13-11 15-12
In our opinion , this is exactly the opposite of what should have been done .	Em nosso entender , é exactamente o contrário do que deveria ter sido feito .	0-0 1-1 2-2 3-3 4-4 5-4 6-5 7-6 8-7 9-8 10-9 11-10 12-11 13-12 14-13 15-14
I believe that the World Health Organisation has taken the correct approach on this issue .	Considero que a Organização Mundial de Saúde adoptou a abordagem correcta a este respeito .	0-0 1-0 2-1 3-2 6-3 4-4 5-6 7-7 8-7 9-8 11-9 10-10 12-11 13-12 14-13 15-14
The rapporteur wavers between the redistribution of appropriations and their increase without ever being clear .	O relator oscila entre a redistribuição de verbas e o aumento das mesmas , sem nunca ser claro .	0-0 1-1 2-2 3-3 4-4 5-5 6-6 7-7 8-8 10-10 9-12 11-14 12-15 13-16 14-17 15-18
However , in my view , the amendments that remain are neither necessary nor helpful .	Contudo , a meu ver , as alterações que subsistem não são necessárias nem úteis .	0-0 1-1 2-2 3-3 4-4 5-5 6-6 7-7 8-8 9-9 11-10 10-11 12-12 13-13 14-14 15-15
Mr President , Mr Casaca , stringency is one thing , but coherence is another .	Senhor Presidente , Senhor Deputado , rigor é uma coisa , mas coerência é outra .	0-0 1-1 2-2 3-3 4-4 5-5 6-6 7-7 8-8 9-9 10-10 11-11 12-12 13-13 14-14 15-15
The McCartin report is an important part of the process of reforming the common policy .	O relatório McCartin é um elemento importante para o processo de reforma da política comum .	0-0 2-1 1-2 3-3 4-4 6-5 5-6 7-7 8-8 9-9 10-10 11-11 12-12 14-13 13-14 15-15
The EU is to be a state with a common police force , currency and military .	A UE vai ser um Estado com polícia , moeda e defesa comuns .	0-0 1-1 2-2 3-2 4-3 5-4 6-5 7-6 10-7 11-7 12-8 13-9 14-10 15-11 9-12 16-13
Without civilisation , there is no progress , and without human rights , there is no civilisation .	Sem civilização não há progresso , e sem direitos humanos não há civilização .	0-0 1-1 5-2 3-3 4-3 6-4 7-5 8-6 9-7 11-8 10-9 15-10 13-11 14-11 16-12 17-13
For several months , this decision impeded the proper functioning of Albania 's democratic institutions .	Durante vários meses , essa decisão impediu o adequado funcionamento das instituições democráticas da Albânia .	0-0 1-1 2-2 3-3 4-4 5-5 6-6 7-7 8-8 9-9 10-10 14-11 13-12 12-13 11-14 15-15
The Commission is convinced of the importance of a comprehensive dialogue between the two leaders .	A Comissão está convicta da importância de um diálogo abrangente entre os dois dirigentes .	0-0 1-1 2-2 3-3 4-4 5-4 6-5 7-6 8-7 10-8 9-9 11-10 12-11 13-12 14-13 15-14
I shall return to this point , Mr President , in my explanation of vote .	Voltarei a esta questão , Senhor Presidente , na minha declaração de voto .	0-0 1-0 2-0 3-1 4-2 5-3 6-4 7-5 8-6 9-7 10-8 11-9 12-10 13-11 14-12 15-13
The Commission fully supports these improvements and urges the European Parliament to do the same .	A Comissão apoia plenamente estas melhorias e insta o Parlamento Europeu a fazer o mesmo .	0-0 1-1 3-2 2-3 4-4 5-5 6-6 7-7 8-8 10-9 9-10 11-11 12-12 13-13 14-14 15-15
After all , every other state has a national assembly elected by a uniform method .	Afinal , qualquer Estado tem uma assembleia nacional eleita por um método uniforme .	0-0 1-0 2-1 3-2 4-2 5-3 6-4 7-5 9-6 8-7 10-8 11-9 12-10 14-11 13-12 15-13
The basic structure of a framework directive outlined in the Green Paper was broadly accepted .	A estrutura básica de uma directiva-quadro delineada no Livro Verde foi largamente aceite .	0-0 2-1 1-2 3-3 4-4 5-5 6-5 7-6 8-7 9-7 11-8 10-9 12-10 13-11 14-12 15-13
On that point , it is vital that these elections are demonstrably free and fair .	Nesse contexto , é vital que essas eleições sejam manifestamente livres e justas .	0-0 1-0 2-1 3-2 4-3 5-3 6-4 7-5 8-6 9-7 10-8 11-9 12-10 13-11 14-12 15-13
Mr President , it is not a point of order , it is a reminder .	Senhor Presidente , não é um ponto de ordem , é um memorando .	0-0 1-1 2-2 5-3 3-4 4-4 6-5 7-6 8-7 9-8 10-9 11-10 12-10 13-11 14-12 15-13
I do not know if my life is in some way threatened by her words .	Não sei se a minha vida está de alguma forma ameaçada pelas suas palavras .	2-0 0-1 1-1 3-1 4-2 5-4 6-5 7-6 8-7 9-8 10-9 11-10 12-11 13-12 14-13 15-14
It covers the aid which will be given through the EU 's various financial instruments .	Abrange o apoio que será concedido através dos diferentes instrumentos financeiros da UE .	0-0 1-0 2-1 3-2 4-3 5-4 6-4 7-5 8-6 9-7 12-8 14-9 13-10 11-11 10-12 15-13
In several areas I fully support him : openness , transparency , freedom of information .	Apoio-o inteiramente em diversas áreas : abertura , transparência , liberdade de informação .	3-0 5-0 6-0 4-1 0-2 1-3 2-4 7-5 8-6 9-7 10-8 11-9 12-10 13-11 14-12 15-13
Some preparatory work has been done , but neither of the studies has been started .	Foi realizado algum trabalho preparatório , mas nenhum dos estudos teve início .	3-0 4-0 5-1 0-2 2-3 1-4 6-5 7-6 8-7 9-8 10-8 11-9 12-10 13-10 14-11 15-12
There is only one source of money available here and that is the first pillar .	Só existe uma fonte de verbas disponível aqui e esta é o primeiro pilar .	2-0 0-1 1-1 3-2 4-3 5-4 6-5 7-6 8-7 9-8 10-9 11-10 12-11 13-12 14-13 15-14
I saw it with my own eyes : it was the EU at its best .	Vi isso com os meus próprios olhos : foi a UE no seu melhor !	0-0 1-0 2-1 3-2 4-4 5-5 6-6 7-7 8-8 9-8 10-9 11-10 12-11 13-12 14-13 15-14
The complexity and diversity of this indispensable partnership inevitably generate a certain degree of friction .	A complexidade e diversidade desta parceira indispensável geram inevitavelmente um certo grau de crispação .	0-0 1-1 2-2 3-3 4-4 5-4 7-5 6-6 9-7 8-8 10-9 11-10 12-11 13-12 14-13 15-14
In other words , the EU can do a lot more with the same money .	Por outras palavras , a UE pode fazer muito mais com o mesmo dinheiro .	0-0 1-1 2-2 3-3 4-4 5-5 6-6 7-7 8-8 9-8 10-9 11-10 12-11 13-12 14-13 15-14
It is , of course , important that it identifies concrete priorities for the future .	É , obviamente , importante que ela identifique prioridades concretas para o futuro .	0-0 1-0 2-1 3-2 4-2 5-3 6-4 7-5 8-6 9-7 11-8 10-9 12-10 13-11 14-12 15-13
The report emphasises three horizontal issues of great importance to the success of the strategy .	O relatório destaca três questões horizontais de grande importância para o sucesso da estratégia .	0-0 1-1 2-2 3-3 5-4 4-5 6-6 7-7 8-8 9-9 10-10 11-11 12-12 13-12 14-13 15-14
If the applicant countries read the Hughes report , they may not want to join .	Caso os países candidatos leiam o relatório Hughes , poderão não querer aderir .	0-0 1-1 3-2 2-3 4-4 5-5 7-6 6-7 8-8 9-9 10-9 11-10 12-11 13-11 14-12 15-13
Simply , a new Community vision of nuclear security and the treatment of radioactive waste .	Simplesmente , uma nova visão comunitária da segurança nuclear e do tratamento dos resíduos radioactivos .	0-0 1-1 2-2 3-3 5-4 4-5 6-6 8-7 7-8 9-9 10-10 11-11 12-12 14-13 13-14 15-15
Mr President , as you all know , I was the original rapporteur for this report .	Senhor Presidente , como sabem fui o relator inicial deste relatório .	0-0 1-1 2-2 3-3 4-4 5-4 6-4 8-5 9-5 10-6 12-7 11-8 13-9 14-9 15-10 16-11
It is in this spirit that progress must be made in the area of cooperation .	É dentro deste espírito que se deve avançar na área da cooperação .	0-0 1-0 2-1 3-2 4-3 5-4 8-5 7-6 6-7 9-7 10-8 12-9 11-10 13-10 14-11 15-12
Another major change is the strategic planning using the Annual Policy Strategy within the Commission .	Outra grande mudança é o planeamento estratégico através da estratégica política anual dentro da Comissão .	0-0 1-1 2-2 3-3 4-4 6-5 5-6 7-7 8-8 11-9 10-10 9-11 12-12 13-13 14-14 15-15
I am fully aware that the police and prosecution services long for a framework directive .	Sei perfeitamente que os serviços policiais e judiciais anseiam por uma directiva-quadro .	0-0 1-0 3-0 2-1 4-2 5-3 9-4 6-5 7-6 8-7 10-8 11-9 12-10 13-11 14-11 15-12
I welcome the fact that this directive will lower the exposure limit values for asbestos .	É com prazer que acolho o facto de esta directiva ir reduzir os valores limite de exposição ao amianto .	0-4 1-4 2-5 3-6 4-6 5-8 6-9 7-10 8-11 9-12 12-13 11-14 10-16 13-17 14-18 15-19
This creativity has been of great help , but it is not especially open or transparent .	Esta criatividade tem sido muito útil , mas não é especialmente aberta nem transparente .	0-0 1-1 2-2 3-3 5-4 6-5 7-6 8-7 11-8 9-9 10-9 12-10 13-11 14-12 15-13 16-14
The charge sheet reads : lack of a decent system of European ports of refuge .	O registo de acusação diz : falta de um sistema de portos de refúgio europeus decente .	0-0 1-3 2-3 3-4 4-5 5-6 6-7 7-8 9-9 10-10 12-11 13-12 14-13 11-14 8-15 15-16
I can answer that the Council has not been informed of the event in question .	Posso responder que o Conselho não tem conhecimento do incidente em questão .	0-0 1-0 2-1 3-2 4-3 5-4 7-5 6-6 8-6 9-7 10-8 11-8 12-9 13-10 14-11 15-12
France and the United Kingdom have a right of veto which would prevent this intervention .	A Grã-Bretanha e a França possuem um direito de veto que impediria tal intervenção .	3-1 4-1 1-2 2-3 0-4 5-5 6-6 7-7 8-8 9-9 10-10 11-11 12-11 13-12 14-13 15-14
The European Union needs to have a view and an opinion about this new world .	A União Europeia tem de ter uma visão e uma opinião sobre esse mundo novo .	0-0 2-1 1-2 3-3 4-4 5-5 6-6 7-7 8-8 9-9 10-10 11-11 12-12 14-13 13-14 15-15
Mr President , ladies and gentlemen , we run the risk today of repeating ourselves .	Senhor Presidente , Senhoras e Senhores , hoje corremos o risco de nos repetir .	0-0 1-1 2-2 3-3 4-4 5-5 6-6 11-7 7-8 8-8 9-9 10-10 12-11 14-12 13-13 15-14
This doctrine should , therefore , be expressly criticised and rejected by the European Parliament .	Essa doutrina devia , portanto , ser expressamente criticada e refutada pelo Parlamento Europeu .	0-0 1-1 2-2 3-3 4-4 5-5 6-6 7-7 8-8 9-9 10-10 11-11 12-11 14-12 13-13 15-14
We are now faced with something more , something different , and that is positive .	Estamos agora perante algo mais , algo diferente , e isso é positivo .	0-0 1-0 2-1 3-2 4-2 5-3 6-4 7-5 8-6 9-7 10-8 11-9 12-10 13-11 14-12 15-13
In this context , it is a compromise that is acceptable as a transition towards a definitive situation .	Neste contexto , é um compromisso aceitável como transição para uma situação definitiva .	0-0 1-0 2-1 3-2 4-3 5-3 6-4 7-5 10-6 11-7 13-8 14-9 15-10 17-11 16-12 18-13
In any such sensitive issue , no one will be completely happy with the outcome .	Num assunto tão espinhoso , ninguém ficará completamente satisfeito com o resultado .	0-0 1-1 2-2 3-3 4-3 5-4 6-5 7-5 8-6 9-6 10-7 11-8 12-9 13-10 14-11 15-12
In my opinion , we should also adapt the economic policy to the social policy .	Em minha opinião , deveríamos também adaptar a política económica à política social .	0-0 1-1 2-2 3-3 4-4 5-4 6-5 7-6 8-7 10-8 9-9 11-10 12-10 14-11 13-12 15-13
The authors of the joint resolution are aware of the general concern caused by GATS .	Os autores da resolução comum estão conscientes da preocupação geral suscitada pelo GATS .	0-0 1-1 2-2 3-2 5-3 4-4 6-5 7-6 8-7 9-7 11-8 10-9 12-10 13-11 14-12 15-13
The structure and control of the operation are vital to the command of the operation .	A estrutura e o controlo da operação são vitais para o comando da operação .	0-0 1-1 2-2 3-4 4-5 5-5 6-6 7-7 8-8 9-9 10-10 11-11 12-12 13-12 14-13 15-14
The European Union has also demonstrated that the common foreign policy has not been common .	A União Europeia demonstrou também que a política externa comum não foi comum .	0-0 2-1 1-2 3-3 5-3 4-4 6-5 7-6 10-7 9-8 8-9 12-10 11-11 13-11 14-12 15-13
In 1995 and 1998 , the UN , NATO and the European Union were unanimous .	Em 1995 e 1998 , foram a ONU , a NATO e a União Europeia , e houve unanimidade .	0-0 1-1 2-2 3-3 4-4 5-6 6-7 7-8 8-10 9-11 10-12 12-13 11-14 13-17 14-18 15-19
With regard to action , the European Council invited the Commission to consider several problems .	Em matéria de actos , o Conselho Europeu convida a Comissão a analisar muitos problemas .	0-0 1-1 2-2 3-3 4-4 5-5 7-6 6-7 8-8 9-9 10-10 11-11 12-12 13-13 14-14 15-15
This programme , I am sad to say , has been cut by the Council .	Este programa , lamento dizê-lo , foi cortado pelo Conselho .	0-0 1-1 2-2 3-3 4-3 5-3 6-4 7-4 8-5 9-6 10-6 11-7 12-8 13-8 14-9 15-10
I now turn to Paragraphs 6 and 7 in the current text of the report .	Passo agora aos nºs 6 e 7 do texto actual do relatório .	0-0 2-0 1-1 3-2 4-3 5-4 6-5 7-6 8-7 9-7 11-8 10-9 12-10 13-10 14-11 15-12
